route_id,original_route_id,mode,route_short_name,route_long_name,route_type
bus_3,3,bus,102,ADYAR B.T To SIRUSERI I.T PARK,3
bus_7,7,bus,102,BROADWAY To KELAMBAKKAM B.T,3
bus_8,8,bus,102,KELAMBAKKAM B.T To BROADWAY,3
bus_9,9,bus,102,BROADWAY To SIRUSERI I.T.PARK,3
bus_10,10,bus,102,SIRUSERI I.T.PARK To BROADWAY,3
bus_13,13,bus,102,M.G.R.CENTRAL To KELAMBAKKAM,3
bus_17,17,bus,102C,BROADWAY To SEMMANCHERI BUS STAND,3
bus_18,18,bus,102C,SEMMANCHERI BUS STAND To BROADWAY,3
bus_19,19,bus,102C,TIDEL PARK To SEMMANCHERI TNUHDB,3
bus_20,20,bus,102C,SEMMANCHERI TNUHDB To TIDEL PARK,3
bus_21,21,bus,102KCT,ADYAR B.T To EZHIL NAGAR,3
bus_22,22,bus,102KCT,EZHIL NAGAR To ADYAR B.T,3
bus_23,23,bus,102KCT,ADYAR B.T To KANNAGI NAGAR B.T,3
bus_24,24,bus,102KCT,KANNAGI NAGAR B.T To ADYAR B.T,3
bus_27,27,bus,102KX,BROADWAY To KANNAGI NAGAR EZHIL NAGAR,3
bus_28,28,bus,102KX,KANNAGI NAGAR EZHIL NAGAR To BROADWAY,3
bus_29,29,bus,102K,BROADWAY To KANNAGI NAGAR B.T,3
bus_30,30,bus,102K,KANNAGI NAGAR B.T To BROADWAY,3
bus_36,36,bus,102P,GREAMS ROAD To BROADWAY,3
bus_37,37,bus,102P,BROADWAY To Perumbakkam TNUHDB,3
bus_38,38,bus,102P,Perumbakkam TNUHDB To BROADWAY,3
bus_39,39,bus,102P,BROADWAY To SANTHOME SCHOOL,3
bus_40,40,bus,102P,SANTHOME SCHOOL To BROADWAY,3
bus_42,42,bus,102P,PERUMBAKKAM TNUHDB To GREAMS ROAD,3
bus_43,43,bus,102P,SANTHOME SCHOOL To PERUMBAKKAM TNUHDB,3
bus_44,44,bus,102P,PERUMBAKKAM TNUHDB To SANTHOME SCHOOL,3
bus_45,45,bus,102X,BROADWAY To THIRUPORUR BUS STAND,3
bus_46,46,bus,102X,THIRUPORUR BUS STAND To BROADWAY,3
bus_49,49,bus,102X,M.G.R.CENTRAL R.S To THIRUPORUR BUS STAND,3
bus_50,50,bus,102X,THIRUPORUR To M.G.R.CENTRAL,3
bus_51,51,bus,109,ADYAR B.T To KOVALAM,3
bus_52,52,bus,109,KOVALAM To ADYAR B.T,3
bus_55,55,bus,109,BROADWAY To ADYAR B.T,3
bus_56,56,bus,109,ADYAR B.T To BROADWAY,3
bus_59,59,bus,109,BROADWAY To KOVALAM B.T,3
bus_60,60,bus,109,KOVALAM B.T To BROADWAY,3
bus_63,63,bus,109A,BROADWAY To THIRUVIDHANTHAI,3
bus_64,64,bus,109A,THIRUVIDANTHAI To BROADWAY,3
bus_69,69,bus,109,THIRUVANMIYUR To KOVALAM,3
bus_70,70,bus,109,KOVALAM To THIRUVANMIYUR,3
bus_73,73,bus,109T,BROADWAY To KOVALAM,3
bus_74,74,bus,109T,KOVALAM To BROADWAY,3
bus_75,75,bus,109T,THIRUVOTTIYUR BUS STAND To KOVALAM B.T,3
bus_76,76,bus,109T,KOVALAM B.T To THIRUVOTTIYUR BUS STAND,3
bus_79,79,bus,109X,BROADWAY To THIRUPORUR BUS STAND,3
bus_80,80,bus,109X,THIRUPORUR To BROADWAY,3
bus_83,83,bus,15,BROADWAY To M.G.R.KOYAMBEDU B.T,3
bus_84,84,bus,15,M.G.R.KOYAMBEDU B.T To BROADWAY,3
bus_87,87,bus,15F,BROADWAY To VADAPALANI BUS STAND,3
bus_88,88,bus,15F,VADAPALANI BUS STAND To BROADWAY,3
bus_91,91,bus,17D,BROADWAY To K.K.NAGAR,3
bus_92,92,bus,17D,K.K.NAGAR To BROADWAY,3
bus_95,95,bus,17E,BROADWAY To SALIGRAMAM BUS STAND,3
bus_96,96,bus,17E,SALIGRAMAM BUS STAND To BROADWAY,3
bus_97,97,bus,17E,VADAPALANI BUS STAND To SALIGRAMAM BUS STAND,3
bus_98,98,bus,17E,SALIGRAMAM BUS STAND To VADAPALANI BUS STAND,3
bus_101,101,bus,21,BROADWAY To GUINDY TVK ESTATE,3
bus_102,102,bus,21,GUINDY TVK ESTATE To BROADWAY,3
bus_103,103,bus,21,BROADWAY To MANDAVELI B.T,3
bus_104,104,bus,21,MANDAVELI B.T To BROADWAY,3
bus_107,107,bus,21C,BROADWAY To KANNAGI NAGAR B.T,3
bus_108,108,bus,21C,KANNAGI NAGAR B.T To BROADWAY,3
bus_109,109,bus,21C,BROADWAY To MYLAPORE TANK,3
bus_110,110,bus,21C,MYLAPORE TANK To BROADWAY,3
bus_111,111,bus,21C,MYLAPORE TANK To KANNAGI NAGAR TNUHDB,3
bus_112,112,bus,21C,KANNAGI NAGAR TNUHDB To MYLAPORE TANK,3
bus_115,115,bus,21G,BROADWAY To KILAMBAKKAM BUS TERMINUS,3
bus_116,116,bus,21G,KILAMBAKKAM BUS TERMINUS To BROADWAY,3
bus_117,117,bus,21G,BROADWAY To TAMBARAM WEST,3
bus_118,118,bus,21G,TAMBARAM WEST To BROADWAY,3
bus_121,121,bus,21GC,BROADWAY To GUINDY TVK ESTATE,3
bus_122,122,bus,21GC,GUINDY TVK ESTATE To BROADWAY,3
bus_123,123,bus,21GCT,BROADWAY To KCBT - KILAMBAKKAM,3
bus_127,127,bus,221,M.G.R.CENTRAL To KELAMBAKKAM,3
bus_128,128,bus,221,KELAMBAKKAM To M.G.R.CENTRAL,3
bus_129,129,bus,221,M.G.R.CENTRAL OR RAJIV GANDHI GOVERNMENT GENERAL HOSPITAL To THIRUPORUR BUS STAND,3
bus_130,130,bus,221,THIRUPORUR BUS STAND To M.G.R.CENTRAL R.S,3
bus_139,139,bus,26,BROADWAY To IYYAPPANTHANGAL B.T,3
bus_140,140,bus,26,IYYAPPANTHANGAL B.T To BROADWAY,3
bus_141,141,bus,26CT,BROADWAY To VADAPALANI BUS STAND,3
bus_142,142,bus,26CT,VADAPALANI BUS STAND To BROADWAY,3
bus_145,145,bus,26CT,M.G.R.CENTRAL To IYYAPPANTHANGAL,3
bus_149,149,bus,28,THIRUVOTRIYUR B.T To EGMORE NORTH R.S,3
bus_150,150,bus,28,EGMORE NORTH R.S To THIRUVOTRIYUR B.T,3
bus_153,153,bus,29A,PERAMBUR B.T To WAR MEMORIAL,3
bus_154,154,bus,29A,WAR MEMORIAL To PERAMBUR B.T,3
bus_157,157,bus,32C,M.G.R.CENTRAL To CHINDATHARIPET,3
bus_158,158,bus,32C,CHINDATHARIPET To M.G.R.CENTRAL,3
bus_161,161,bus,32C,VALLALAR NAGAR To CHINTADRIPET MRTS,3
bus_162,162,bus,32C,CHINTADRIPET MRTS To VALLALAR NAGAR,3
bus_165,165,bus,40A,WAR MEMORIAL To PATTABIRAM B.T,3
bus_166,166,bus,40A,PATTABIRAM To WAR MEMORIAL,3
bus_167,167,bus,40H,ANNA SQUARE B.T To AVADI B.T,3
bus_168,168,bus,40H,AVADI B.T To WAR MEMORIAL,3
bus_171,171,bus,40H,WAR MEMORIAL To PATTABIRAM B.T,3
bus_172,172,bus,40H,PATTABIRAM To WAR MEMORIAL,3
bus_175,175,bus,50ET,BROADWAY To AYYAPPAN MADAM,3
bus_176,176,bus,50ET,AYYAPPAN MADAM To BROADWAY,3
bus_177,177,bus,50ET,BROADWAY To THIRUVERKADU,3
bus_178,178,bus,50ET,THIRUVERKADU To BROADWAY,3
bus_181,181,bus,53E,BROADWAY To KUNDRATHUR THANDALAM,3
bus_182,182,bus,53E,KUNDRATHUR B.T To BROADWAY,3
bus_185,185,bus,54CT,BROADWAY To MUGALIVAKKAM A.G.S.OFFICER'S COLONY,3
bus_186,186,bus,54CT,MUGALIVAKKAM AGSCO To BROADWAY,3
bus_187,187,bus,54,BROADWAY To POONAMALLEE B.T,3
bus_188,188,bus,54,POONAMALLEE B.T To BROADWAY,3
bus_191,191,bus,54CT,M.G.R.CENTRAL To POONAMALLEE B.T,3
bus_195,195,bus,5C,BROADWAY To TARAMANI B.T,3
bus_196,196,bus,5C,TARAMANI B.T To BROADWAY,3
bus_199,199,bus,6,BROADWAY To SRINIVASAPURAM,3
bus_200,200,bus,6,SRINIVASAPURAM To BROADWAY,3
bus_201,201,bus,6,BROADWAY To THIRUVANMIYUR B.T,3
bus_202,202,bus,6,THIRUVANMIYUR B.T To BROADWAY,3
bus_205,205,bus,7H,BROADWAY To JJ NAGAR EAST,3
bus_206,206,bus,7H,JJ NAGAR EAST To BROADWAY,3
bus_207,207,bus,7H,DOVETON To J.J.NAGAR EAST,3
bus_208,208,bus,7H,J.J.NAGAR EAST To DOVETON,3
bus_211,211,bus,7M,BROADWAY To J.J NAGAR WEST B.T,3
bus_212,212,bus,7M,J.J NAGAR WEST B.T To BROADWAY,3
bus_216,216,bus,21M,KOVUR To BROADWAY,3
bus_217,217,bus,88K,BROADWAY To KUNDRATHUR B.T,3
bus_218,218,bus,88K,KUNDRATHUR B.T To BROADWAY,3
bus_224,224,bus,1CT,THIRUVANMIYUR To BROADWAY,3
bus_229,229,bus,A1,M.G.R.CENTRAL To SECRETARIAT,3
bus_230,230,bus,A1,SECRETARIAT To M.G.R.CENTRAL,3
bus_231,231,bus,A1,M.G.R.CENTRAL R.S To THIRUVANMIYUR B.T,3
bus_232,232,bus,A1,THIRUVANMIYUR B.T To M.G.R.CENTRAL R.S,3
bus_235,235,bus,A1ET,M.G.R.CENTRAL OR RAJIV GANDHI GOVERNMENT GENERAL HOSPITAL To OKK.THORAIPAKM SEC.COLONY,3
bus_236,236,bus,A1ET,OKK.THORAIPAKM SEC.COLONY To M.G.R.CENTRAL R.S,3
bus_239,239,bus,A51,BROADWAY To TAMBARAM WEST BUS STAND,3
bus_240,240,bus,A51,TAMBARAM WEST BUS STAND To BROADWAY,3
bus_241,241,bus,A51,VELACHERY B.T To TAMBARAM WEST,3
bus_242,242,bus,A51,TAMBARAM WEST BUS STAND To VELACHERY,3
bus_245,245,bus,E18,BROADWAY To GUDUVANCHERI B.T,3
bus_246,246,bus,E18,GUDUVANCHERI BUS TERMINUS To BROADWAY,3
bus_247,247,bus,E18,BROADWAY To TAMBARAM WEST,3
bus_248,248,bus,E18,TAMBARAM WEST To BROADWAY,3
bus_251,251,bus,S21C,M.G.R.CENTRAL OR RAJIV GANDHI GOVERNMENT GENERAL HOSPITAL To MYLAPORE TANK,3
bus_252,252,bus,S21C,MYLAPORE TANK To M.G.R.CENTRAL R.S,3
bus_253,253,bus,12X,FORESHORE ESTATE To KOYAMBEDU MARKET,3
bus_254,254,bus,12X,FORESHORE ESTATE BUS TERMINUS To M.G.R.KOYAMBEDU B.T,3
bus_257,257,bus,12X,KOYAMBEDU MARKET To FORESHORE ESTATE BUS TERMINUS,3
bus_258,258,bus,12X,M.G.R.KOYAMBEDU B.T To FORESHORE ESTATE BUS TERMINUS,3
bus_261,261,bus,21,M.G.R.CENTRAL To MANDAVELI,3
bus_262,262,bus,21,M.G.R.CENTRAL To THIRUVANMIYUR,3
bus_264,264,bus,21,MANDAVELI To M.G.R.CENTRAL,3
bus_268,268,bus,21,THIRUVANMIYUR To M.G.R.CENTRAL,3
bus_271,271,bus,27D,FORESHORE ESTATE To I.C.F,3
bus_276,276,bus,27D,ICF To FORESHORE ESTATE BUS TERMINUS,3
bus_277,277,bus,40L,WAR MEMORIAL To J.J NAGAR WEST B.T,3
bus_278,278,bus,40L,CHEPAUK To FORESHORE ESTATE,3
bus_280,280,bus,40L,J.J NAGAR WEST B.T To WAR MEMORIAL,3
bus_282,282,bus,40L,FORESHORE ESTATE To CHEPAUK,3
bus_284,284,bus,41D,AMBATTUR O.T B.T To MANDAVELI B.T,3
bus_286,286,bus,41D,MANDAVELI B.T To RAAKI THEATRE,3
bus_287,287,bus,41D,MANDAVELI B.T To AVADI B.T,3
bus_289,289,bus,49F,IYYAPPANTHANGAL B.T To MANDAVELI B.T,3
bus_291,291,bus,49F,MANDAVELI To IYYAPPANTHANGAL,3
bus_293,293,bus,49F,MANDAVELI B.T To POONAMALLEE B.T,3
bus_296,296,bus,49F,POONAMALLEE B.T To MANDAVELI B.T,3
bus_300,300,bus,597,FORESHORE ESTATE To THIRUVALLUR,3
bus_301,301,bus,597,POONAMALLEE B.T To THIRUVALLUR,3
bus_302,302,bus,597,THIRUVALLUR To FORESHORE ESTATE,3
bus_303,303,bus,597,THIRUVALLUR To POONAMALLEE B.T,3
bus_304,304,bus,597,THYAGARAYA NAGAR BUS TERMINUS To THIRUVALLUR,3
bus_309,309,bus,5B,MYLAPORE TANK To THYAGARAYA NAGAR BUS TERMINUS,3
bus_310,310,bus,5B,THYAGARAYA NAGAR BUS TERMINUS To MYLAPORE TANK,3
bus_311,311,bus,S17,ADYAR GANDHI NAGAR To MANDAVELI B.T,3
bus_313,313,bus,S17,KALIYAPPA HOSPITAL RAJA ANNAMALAI PURAM To ADYAR GANDHI NAGAR,3
bus_316,316,bus,S5,FORT STATION To M.G.R.CENTRAL,3
bus_317,317,bus,S5,FORT RAILWAY STATION To SECRETARIAT,3
bus_320,320,bus,S5,M.G.R.CENTRAL To MANDAVELI,3
bus_321,321,bus,S5,M.G.R.CENTRAL To SECRETARIAT,3
bus_323,323,bus,S5,MANDAVELI To M.G.R.CENTRAL,3
bus_325,325,bus,S5,SECRETARIAT To FORT RAILWAY STATION,3
bus_326,326,bus,S5,SECRETARIAT To M.G.R.CENTRAL,3
bus_327,327,bus,597,THIRUVALLUR To THYAGARAYA NAGAR BURKIT ROAD,3
bus_329,329,bus,41D,AVADI B.T To MANDAVELI,3
bus_333,333,bus,102,ADYAR DEPOT To KELAMBAKKAM,3
bus_335,335,bus,102,ADYAR B.T To BROADWAY,3
bus_336,336,bus,102,BROADWAY To ADYAR B.T,3
bus_337,337,bus,102,KELAMBAKKAM To ADYAR DEPOT,3
bus_339,339,bus,102CT,ADYAR B.T To SIRUSERI I.T PARK,3
bus_340,340,bus,102CT,ADYAR B.T To THAIYUR KOMAN NAGAR,3
bus_343,343,bus,102CT,BROADWAY To SIRUSERI I.T PARK,3
bus_344,344,bus,102CT,OKK.THORAIPAKM SEC.COLONY To BROADWAY,3
bus_346,346,bus,102CT,PERUMBAKKAM TNUHDB To BROADWAY,3
bus_348,348,bus,102CT,SIRUSERI I.T PARK To ADYAR B.T,3
bus_350,350,bus,102CT,SIRUSERI I.T.PARK To THIRUVANMIYUR B.T,3
bus_351,351,bus,102CT,SIRUSERI I.T.PARK To TIDEL PARK,3
bus_352,352,bus,102CT,THAIYUR KOMAN NAGAR To ADYAR B.T,3
bus_354,354,bus,102CT,THIRUVANMIYUR To OKK.THORAIPAKM SEC.COLONY,3
bus_355,355,bus,102CT,THIRUVANMIYUR To PERUMBAKKAM TNUHDB,3
bus_356,356,bus,102CT,THIRUVANMIYUR B.T To SIRUSERI I.T.PARK,3
bus_357,357,bus,102CT,TIDEL PARK To SIRUSERI I.T.PARK,3
bus_360,360,bus,102M,ADYAR B.T To MANAMATHI ACHARAVAKKAM,3
bus_361,361,bus,102M,MANAMATHI ACHARAVAKKAM To ADYAR B.T,3
bus_365,365,bus,102P,ADYAR GATE To BROADWAY,3
bus_366,366,bus,102P,ADYAR GATE To PERUMBAKKAM TNUHDB,3
bus_368,368,bus,102P,PERUMBAKKAM TNUHDB To ADYAR GATE,3
bus_371,371,bus,102P,THIRUVANMIYUR To PERUMBAKKAM TNUHDB,3
bus_375,375,bus,109CT,ADYAR DEPOT To KOVALAM,3
bus_376,376,bus,109CT,KOVALAM To ADYAR DEPOT,3
bus_377,377,bus,109C,KOVALAM B.T To THIRUVANMIYUR B.T,3
bus_378,378,bus,109C,THIRUVANMIYUR DEPOT To KOVALAM B.T,3
bus_381,381,bus,109CT,ADYAR B.T To KOVALAM B.T,3
bus_382,382,bus,109CT,KOVALAM B.T To ADYAR B.T,3
bus_384,384,bus,119,ADYAR B.T To SEMMANCHERI TNUHDB,3
bus_385,385,bus,119,GUINDY B.T To SEMMANCHERI BUS STAND,3
bus_386,386,bus,119,SEMMANCHERI TNUHDB To ADYAR DEPOT,3
bus_387,387,bus,119,SEMMANCHERI BUS STAND To GUINDY B.T,3
bus_388,388,bus,14M,A.G.S.OFFICER'S COLONY To MEDAVAKKAM RD.JN,3
bus_392,392,bus,14M,MEDAVAKKAM RD.JN To A.G.S.OFFICER'S COLONY,3
bus_394,394,bus,14M,MEDAVAKKAM RD.JN To N.G.O.COLONY,3
bus_395,395,bus,14M,MEDAVAKKAM RD.JN To SAIDAPET,3
bus_398,398,bus,14M,N.G.O.COLONY To MEDAVAKKAM RD.JN,3
bus_399,399,bus,14M,SAIDAPET To MEDAVAKKAM RD.JN,3
bus_401,401,bus,18D,BROADWAY To U.T.I BANK OR MADIPAKKAM ROAD JUNCTION,3
bus_402,402,bus,18D,MADIPAKKAM RD.JN To BROADWAY,3
bus_403,403,bus,18D,KEELKATTALAI To N.G.O.COLONY,3
bus_405,405,bus,18D,NGO COLONY To MADIPAKKAM B.T,3
bus_409,409,bus,19,ADYAR DEPOT To THIRUPORUR BUS STAND,3
bus_410,410,bus,19,ADYAR DEPOT To THYAGARAYA NAGAR,3
bus_412,412,bus,19,KELAMBAKKAM To ADYAR DEPOT,3
bus_413,413,bus,19,KELAMBAKKAM To M.G.R.KOYAMBEDU,3
bus_414,414,bus,19,KELAMBAKKAM To THYAGARAYA NAGAR,3
bus_415,415,bus,19,M.G.R.KOYAMBEDU To KELAMBAKKAM,3
bus_417,417,bus,19,THIRUPORUR To ADYAR DEPOT,3
bus_418,418,bus,19,THIRUPORUR BUS STAND To M.G.R.KOYAMBEDU B.T,3
bus_419,419,bus,19,THIRUPORUR BUS STAND To THYAGARAYA NAGAR BUS TERMINUS,3
bus_420,420,bus,19,THYAGARAYA NAGAR To ADYAR DEPOT,3
bus_421,421,bus,19,THYAGARAYA NAGAR To KELAMBAKKAM,3
bus_422,422,bus,19,THYAGARAYA NAGAR BUS TERMINUS To THIRUPORUR BUS STAND,3
bus_425,425,bus,19C,ADYAR DEPOT To OKK.THORAIPAKM SEC.COLONY,3
bus_426,426,bus,19C,OKK.THORAIPAKM SEC.COLONY To ADYAR DEPOT,3
bus_427,427,bus,19C,OKK.THORAIPAKM SEC.COLONY To THYAGARAYA NAGAR BURKIT ROAD,3
bus_428,428,bus,19C,THYAGARAYA NAGAR BUS TERMINUS To OKK.THORAIPAKM SEC.COLONY,3
bus_432,432,bus,19D,ADYAR B.T To SEMMANCHERI BUS STAND,3
bus_433,433,bus,19D,BESANT NAGAR To PERUMBAKKAM TNUHDB,3
bus_434,434,bus,19D,BESANT NAGAR To SEMMANCHERI TNUHDB,3
bus_436,436,bus,19D,PERUMBAKKAM TNUHDB To BESANT NAGAR,3
bus_437,437,bus,19D,SEMMANCHERI BUS STAND To ADYAR B.T,3
bus_438,438,bus,19D,SEMMANCHERI TNUHDB To BESANT NAGAR,3
bus_446,446,bus,23C,AYANAVARAM B.T To BESANT NAGAR B.T,3
bus_447,447,bus,23C,AYANAVARAM B.T To PERUMBAKKAM TNUHDB,3
bus_449,449,bus,23C,BESANT NAGAR B.T To AYANAVARAM B.T,3
bus_450,450,bus,23C,BESANT NAGAR To EGMORE R.S,3
bus_451,451,bus,23C,BESANT NAGAR To MOUNT ROAD T.V.S,3
bus_452,452,bus,23C,EGMORE R.S To BESANT NAGAR,3
bus_453,453,bus,23C,MOUNT ROAD T.V.S To BESANT NAGAR,3
bus_454,454,bus,23C,MOUNT ROAD T.V.S To PERUMBAKKAM TNUHDB,3
bus_455,455,bus,23C,PERUMBAKKAM TNUHDB To AYANAVARAM B.T,3
bus_456,456,bus,23C,PERUMBAKKAM TNUHDB To MOUNT ROAD T.V.S,3
bus_459,459,bus,29C,BESANT NAGAR B.T To PERAMBUR B.T,3
bus_460,460,bus,29C,PERAMBUR B.T To BESANT NAGAR B.T,3
bus_462,462,bus,29C,PERAMBUR B.T To STERLING ROAD,3
bus_463,463,bus,29CCT,Y.M.I.A To PERAMBUR B.T,3
bus_464,464,bus,29C,STERLING ROAD CHETPAT To PERAMBUR B.T,3
bus_467,467,bus,3,THIRUVANMIYUR B.T To THYAGARAYA NAGAR BUS TERMINUS,3
bus_468,468,bus,3,THYAGARAYA NAGAR BUS TERMINUS To THIRUVANMIYUR B.T,3
bus_472,472,bus,45A,MADIPAKKAM B.T To N.G.O.COLONY,3
bus_474,474,bus,45A,MADIPAKKAM B.T To VIVEKANANDA HOUSE BUS TERMINUS,3
bus_477,477,bus,45A,N.G.O.COLONY To MADIPAKKAM B.T,3
bus_478,478,bus,45A,N.G.O.COLONY To VIVEKANANDA HOUSE,3
bus_481,481,bus,45A,VIVEKANANDA HOUSE BUS TERMINUS To MADIPAKKAM B.T,3
bus_482,482,bus,45A,VIVEKANANDA HOUSE To N.G.O.COLONY,3
bus_485,485,bus,47,BESANT NAGAR B.T To ICF,3
bus_486,486,bus,47,VILLIVAKKAM BUS STAND To BESANT NAGAR B.T,3
bus_488,488,bus,47A,I.C.F To THIRUVANMIYUR,3
bus_490,490,bus,47A,THIRUVANMIYUR To I.C.F,3
bus_491,491,bus,47A,THIRUVANMIYUR B.T To VILLIVAKKAM KALPANA HOTEL,3
bus_492,492,bus,47A,VILLIVAKKAM BUS STAND To THIRUVANMIYUR B.T,3
bus_495,495,bus,519T,ADYAR B.T To THAIYUR KOMAN NAGAR ROAD JUNCTION,3
bus_496,496,bus,519T,THAIYUR KOMAN NAGAR ROAD JUNCTION To ADYAR B.T,3
bus_500,500,bus,51ACT,N.G.O.COLONY To TAMBARAM WEST,3
bus_501,501,bus,51F,SUNNAMBU KOLATHUR To THYAGARAYA NAGAR,3
bus_502,502,bus,51FCT,SUNNAMBU KOLATHUR To VELACHERY B.T,3
bus_503,503,bus,51ACT,TAMBARAM WEST To N.G.O.COLONY,3
bus_504,504,bus,51,TAMBARAM WEST BUS STAND To THYAGARAYA NAGAR BUS TERMINUS,3
bus_505,505,bus,51,TAMBARAM WEST BUS STAND To VELACHERY,3
bus_506,506,bus,51F,THYAGARAYA NAGAR To SUNNAMBU KOLATHUR,3
bus_507,507,bus,51,THYAGARAYA NAGAR To TAMBARAM WEST,3
bus_508,508,bus,51FCT,VELACHERY To SUNNAMBU KOLATHUR,3
bus_509,509,bus,51,VELACHERY To TAMBARAM WEST BUS STAND,3
bus_512,512,bus,51M,MADIPAKKAM B.T To THYAGARAYA NAGAR BUS TERMINUS,3
bus_514,514,bus,51M,N.G.O.COLONY To MADIPAKKAM B.T,3
bus_516,516,bus,51M,THIRUVANMIYUR To THYAGARAYA NAGAR,3
bus_517,517,bus,51M,THYAGARAYA NAGAR BUS TERMINUS To MADIPAKKAM B.T,3
bus_518,518,bus,51M,THYAGARAYA NAGAR To N.G.O.COLONY,3
bus_519,519,bus,51M,THYAGARAYA NAGAR To THIRUVANMIYUR,3
bus_522,522,bus,51X,KCBT - KILAMBAKKAM To TAMBARAM WEST,3
bus_523,523,bus,51X,KILAMBAKKAM BUS TERMINUS To VELACHERY,3
bus_525,525,bus,51AXCT,N.G.O.COLONY To KCBT - KILAMBAKKAM,3
bus_526,526,bus,51CT,N.G.O.COLONY To VELACHERY B.T,3
bus_527,527,bus,51X,TAMBARAM WEST To KCBT - KILAMBAKKAM,3
bus_528,528,bus,51X,VELACHERY To KILAMBAKKAM BUS TERMINUS,3
bus_529,529,bus,51CT,VELACHERY B.T To N.G.O.COLONY,3
bus_531,531,bus,568B,ADYAR DEPOT To THIRUPORUR BUS STAND,3
bus_532,532,bus,568B,THIRUPORUR To ADYAR DEPOT,3
bus_533,533,bus,568B,THIRUPORUR To VELACHERY B.T,3
bus_534,534,bus,568B,VELACHERY To THIRUPORUR BUS STAND,3
bus_537,537,bus,570,ADYAR DEPOT To M.G.R.KOYAMBEDU,3
bus_539,539,bus,570,KELAMBAKKAM To ADYAR DEPOT,3
bus_540,540,bus,570,KELAMBAKKAM B.T To M.G.R.KOYAMBEDU B.T,3
bus_542,542,bus,570,M.G.R.KOYAMBEDU B.T To KELAMBAKKAM B.T,3
bus_543,543,bus,570,M.G.R.KOYAMBEDU B.T To SIRUSERI I.T.PARK,3
bus_544,544,bus,570,M.G.R.KOYAMBEDU To VELACHERY B.T,3
bus_545,545,bus,570,SIRUSERI I.T PARK To ADYAR DEPOT,3
bus_546,546,bus,570,SIRUSERI I.T.PARK To M.G.R.KOYAMBEDU B.T,3
bus_547,547,bus,570,VELACHERY B.T To M.G.R.KOYAMBEDU,3
bus_550,550,bus,570V,ADYAR DEPOT To KELAMBAKKAM,3
bus_553,553,bus,570V,KELAMBAKKAM To VADAPALANI B.T,3
bus_554,554,bus,570V,VADAPALANI To ADYAR DEPOT,3
bus_555,555,bus,570V,VADAPALANI To KELAMBAKKAM,3
bus_557,557,bus,588,KOVALAM B.T To THIRUVANMIYUR DEPOT,3
bus_558,558,bus,588,MAMALLAPURAM B.T To THIRUVANMIYUR B.T,3
bus_560,560,bus,588,THIRUVANMIYUR DEPOT To KOVALAM B.T,3
bus_561,561,bus,588,THIRUVANMIYUR DEPOT To MAMALLAPURAM,3
bus_564,564,bus,5C,ADYAR GANDHI NAGAR To BROADWAY,3
bus_565,565,bus,5C,ADYAR B.T To I.R.T. RD.JN,3
bus_566,566,bus,5C,BROADWAY To ADYAR B.T,3
bus_567,567,bus,5C,I.R.T. RD.JN To ADYAR B.T,3
bus_570,570,bus,5E,BESANT NAGAR B.T To VADAPALANI BUS STAND,3
bus_571,571,bus,5E,VADAPALANI BUS STAND To BESANT NAGAR B.T,3
bus_573,573,bus,76,M.G.R.KOYAMBEDU B.T To MEDAVAKKAM KOOT ROAD,3
bus_574,574,bus,76,MEDAVAKKAM KOOT ROAD To M.G.R.KOYAMBEDU B.T,3
bus_580,580,bus,78,ANNA NAGAR ROUNTANA To BESANT NAGAR,3
bus_581,581,bus,78,BESANT NAGAR B.T To M.G.R.KOYAMBEDU B.T,3
bus_582,582,bus,78,BESANT NAGAR B.T To THIRUMANGALAM EB OFFICE,3
bus_584,584,bus,78,M.G.R.KOYAMBEDU B.T To THIRUVANMIYUR B.T,3
bus_588,588,bus,78,THIRUVANMIYUR B.T To M.G.R.KOYAMBEDU B.T,3
bus_594,594,bus,91,TAMBARAM WEST To THIRUVANMIYUR,3
bus_596,596,bus,91,THIRUVANMIYUR To TAMBARAM WEST,3
bus_598,598,bus,91,KILAMBAKKAM BUS TERMINUS To THIRUVANMIYUR B.T,3
bus_600,600,bus,91K,THIRUVANMIYUR To KCBT - KILAMBAKKAM,3
bus_602,602,bus,91R,KCBT - KILAMBAKKAM To N.G.O.COLONY,3
bus_603,603,bus,91R,KILAMBAKKAM BUS TERMINUS To VELACHERY,3
bus_605,605,bus,91R,N.G.O.COLONY To KCBT - KILAMBAKKAM,3
bus_606,606,bus,91R,VELACHERY To KILAMBAKKAM BUS TERMINUS,3
bus_608,608,bus,91V,GUDUVANCHERY To TAMBARAM WEST,3
bus_609,609,bus,91V,GUDUVANCHERI BUS TERMINUS To THIRUVANMIYUR B.T,3
bus_610,610,bus,91V,TAMBARAM WEST To GUDUVANCHERY,3
bus_611,611,bus,91V,TAMBARAM WEST To THIRUVANMIYUR,3
bus_613,613,bus,91V,THIRUVANMIYUR B.T To GUDUVANCHERI B.T,3
bus_614,614,bus,91V,THIRUVANMIYUR To TAMBARAM WEST,3
bus_616,616,bus,95,KCBT - KILAMBAKKAM To THIRUVANMIYUR,3
bus_617,617,bus,95XCT,SHOLINGANALLUR P.U.OFFICE To TAMBARAM EAST,3
bus_618,618,bus,95,TAMBARAM RAILWAY STATION EAST To P U OFFICE SHOLINGANALLUR,3
bus_619,619,bus,95,TAMBARAM RAILWAY STATION EAST To THIRUVANMIYUR B.T,3
bus_620,620,bus,95,TAMBARAM WEST BUS STAND To THIRUVANMIYUR B.T,3
bus_622,622,bus,95,THIRUVANMIYUR To KCBT - KILAMBAKKAM,3
bus_623,623,bus,95,THIRUVANMIYUR B.T To TAMBARAM EAST,3
bus_624,624,bus,95,THIRUVANMIYUR B.T To TAMBARAM WEST BUS STAND,3
bus_627,627,bus,95X,KILAMBAKKAM BUS TERMINUS To THIRUVANMIYUR B.T,3
bus_630,630,bus,95X,THIRUVANMIYUR B.T To KILAMBAKKAM BUS TERMINUS,3
bus_633,633,bus,99,ADYAR B.T To SHOLINGANALLUR,3
bus_634,634,bus,99,ADYAR B.T To TAMBARAM WEST BUS STAND,3
bus_635,635,bus,99,SHOLINGANALLUR To ADYAR B.T,3
bus_636,636,bus,99,TAMBARAM WEST BUS STAND To ADYAR B.T,3
bus_639,639,bus,99X,ADYAR B.T To KILAMBAKKAM BUS TERMINUS,3
bus_640,640,bus,99X,KILAMBAKKAM BUS TERMINUS To ADYAR B.T,3
bus_641,641,bus,9M,A.G.S.OFFICER'S COLONY To N.G.O.COLONY,3
bus_642,642,bus,9M,ADAMBAKKAM A.G.S.OFFICER'S COLONY To CIT NAGAR,3
bus_645,645,bus,9M,N.G.O.COLONY To A.G.S.OFFICER'S COLONY,3
bus_647,647,bus,9M,N.G.O.COLONY To THYAGARAYA NAGAR,3
bus_648,648,bus,9M,THYAGARAYA NAGAR BUS TERMINUS To ADAMBAKKAM A.G.S.OFFICER'S COLONY-2,3
bus_650,650,bus,9M,THYAGARAYA NAGAR To N.G.O.COLONY,3
bus_651,651,bus,9MET,ADAMBAKKAM A.G.S.OFFICER'S COLONY To BROADWAY,3
bus_653,653,bus,9MET,BROADWAY To ADAMBAKKAM A.G.S.OFFICER'S COLONY-2,3
bus_654,654,bus,9MET,BROADWAY To N.G.O.COLONY,3
bus_656,656,bus,9MET,N.G.O.COLONY To BROADWAY,3
bus_658,658,bus,D70,AMBATTUR INDUSTRIAL ESTATE B.T To VELACHERY,3
bus_660,660,bus,D70,N.G.O.COLONY To VELACHERY B.T,3
bus_661,661,bus,D70,VELACHERY To AMBATTUR INDUSTRIAL ESTATE B.T,3
bus_662,662,bus,D70,VELACHERY B.T To N.G.O.COLONY,3
bus_665,665,bus,J51,N.G.O.COLONY To VENKADAMANGALAM,3
bus_666,666,bus,J51,TAMBARAM WEST BUS STAND To VELACHERY,3
bus_667,667,bus,J51,VELACHERY B.T To TAMBARAM WEST,3
bus_668,668,bus,J51,VELACHERY B.T To VENKADAMANGALAM,3
bus_669,669,bus,J51,VENKADAMANGALAM To N.G.O.COLONY,3
bus_670,670,bus,J51,VENKADAMANGALAM To VELACHERY B.T,3
bus_672,672,bus,M18C,MOOVARASANPET To N.G.O.COLONY,3
bus_673,673,bus,M18C,MOOVARASANPET To THYAGARAYA NAGAR,3
bus_675,675,bus,M18C,N.G.O.COLONY To MOOVARASANPET,3
bus_676,676,bus,M18C,N.G.O.COLONY To THYAGARAYA NAGAR,3
bus_677,677,bus,M18C,THYAGARAYA NAGAR BUS TERMINUS To MOOVARASAMPETTAI,3
bus_678,678,bus,M18C,THYAGARAYA NAGAR To N.G.O.COLONY,3
bus_684,684,bus,M19B,KANNAGI NAGAR B.T To THYAGARAYA NAGAR BUS TERMINUS,3
bus_686,686,bus,M19B,THYAGARAYA NAGAR BUS TERMINUS To KANNAGI NAGAR B.T,3
bus_688,688,bus,M1,MADIPAKKAM B.T To THIRUVANMIYUR,3
bus_690,690,bus,M1,THIRUVANMIYUR To MADIPAKKAM RD.JN,3
bus_692,692,bus,S12,GUINDY RAILWAY STATION To VELACHERY RAILWAY STATION,3
bus_695,695,bus,S12,VELACHERY RAILWAY STATION To GUINDY RAILWAY STATION,3
bus_696,696,bus,S12,VELACHERY B.T To N.G.O.COLONY,3
bus_699,699,bus,S13,ADAMBAKKAM To VELACHERY B.T,3
bus_700,700,bus,S13,GUINDY RAILWAY STATION To VELACHERY,3
bus_701,701,bus,S13,VELACHERY B.T To ADAMBAKKAM,3
bus_702,702,bus,S13,VELACHERY To GUINDY RAILWAY STATION,3
bus_704,704,bus,S18D,KEELKATTALAI To N.G.O.COLONY,3
bus_705,705,bus,S18D,KEELKATTALAI To SAIDAPET,3
bus_707,707,bus,S18D,N.G.O.COLONY To KEELKATTALAI,3
bus_708,708,bus,S18D,NARIKURAVAR COLONY To SAIDAPET GURUKULAM,3
bus_709,709,bus,S18D,SAIDAPET GURUKULAM To NARIKURAVAR COLONY,3
bus_711,711,bus,S18D,SAIDAPET METRO To KEELKATTALAI,3
bus_736,736,bus,T23C,AYANAVARAM B.T To BESANT NAGAR,3
bus_737,737,bus,T23C,AYANAVARAM B.T To THIRUVANMIYUR B.T,3
bus_739,739,bus,T23C,BESANT NAGAR To EGMORE R.S,3
bus_741,741,bus,T23C,EGMORE R.S To THIRUVANMIYUR,3
bus_743,743,bus,T23C,THIRUVANMIYUR B.T To AYANAVARAM B.T,3
bus_744,744,bus,T23C,THIRUVANMIYUR To EGMORE R.S,3
bus_747,747,bus,T29C,MANDAVELI To PERAMBUR B.T,3
bus_748,748,bus,T29C,PERAMBUR B.T To MANDAVELI,3
bus_749,749,bus,T29C,PERAMBUR B.T To STERLING ROAD CHETPAT,3
bus_750,750,bus,T29C,PERAMBUR B.T To THIRUVANMIYUR B.T,3
bus_751,751,bus,T29C,STERLING ROAD CHETPAT To PERAMBUR B.T,3
bus_753,753,bus,T29C,THIRUVANMIYUR B.T To PERAMBUR B.T,3
bus_756,756,bus,11,BROADWAY To THYAGARAYA NAGAR BUS TERMINUS,3
bus_759,759,bus,11,M.G.R.CENTRAL OR RAJIV GANDHI GOVERNMENT GENERAL HOSPITAL To THYAGARAYA NAGAR BUS TERMINUS,3
bus_761,761,bus,13,BROADWAY To THYAGARAYA NAGAR BUS TERMINUS,3
bus_762,762,bus,13,THYAGARAYA NAGAR BUS TERMINUS To TRIPLICANE,3
bus_765,765,bus,154P,THYAGARAYA NAGAR BUS TERMINUS To PATTUR,3
bus_769,769,bus,M19BCT,LITTLE MOUNT To KANNAGI NAGAR TNUHDB,3
bus_771,771,bus,3CT,GUINDY RAILWAY STATION To TIDEL PARK,3
bus_772,772,bus,3CT,THYAGARAYA NAGAR To TIDEL PARK,3
bus_774,774,bus,49A,THYAGARAYA NAGAR BURKIT ROAD To POONAMALLEE B.T,3
bus_778,778,bus,72,THYAGARAYA NAGAR To TAMBARAM WEST,3
bus_780,780,bus,72,THYAGARAYA NAGAR BURKIT ROAD To M.G.R.KOYAMBEDU B.T,3
bus_783,783,bus,S36,NUNGAMBAKKAM RAILWAY STATION To AG DMS METRO STATION,3
bus_784,784,bus,S36,THYAGARAYA NAGAR To NUNGAMBAKKAM R.S,3
bus_787,787,bus,102A,PUDUPAKKAM OR VANDALOOR ROAD JUNCTION To THIRUVANMIYUR B.T,3
bus_789,789,bus,102CT,THIRUVANMIYUR To KELAMBAKKAM,3
bus_791,791,bus,102KCT,THIRUVANMIYUR B.T To KANNAGI NAGAR B.T,3
bus_792,792,bus,109CC,BROADWAY To THIRUVANMIYUR B.T,3
bus_793,793,bus,102PCT,THIRUVANMIYUR B.T To Perumbakkam TNUHDB,3
bus_794,794,bus,102K,BROADWAY To PERUMBAKKAM TNUHDB,3
bus_798,798,bus,102PCT,BROADWAY To PERUMBAKKAM TNUHDB,3
bus_803,803,bus,523,SHOLINGANALLUR P.U.OFFICE To MULLIPAKKAM,3
bus_804,804,bus,523,THIRUPORUR To MULLIPAKKAM,3
bus_805,805,bus,523,THIRUVANMIYUR To MULLIPAKKAM,3
bus_806,806,bus,523,P U OFFICE SHOLINGANALLUR To PERUNTHANDALAM,3
bus_808,808,bus,523A,THIRUPORUR To KARUMBAKKAM,3
bus_809,809,bus,523A,THIRUVANMIYUR To DEVI KARUMARIAMMAN TEMPLE,3
bus_810,810,bus,523A,THIRUVANMIYUR To KARUMBAKKAM,3
bus_811,811,bus,523A,THIRUPORUR To DEVI KARUMARIAMMAN TEMPLE,3
bus_814,814,bus,54R,THIRUVANMIYUR To KUMANANCHAVADI,3
bus_819,819,bus,78,THIRUVANMIYUR To VELACHERY B.T,3
bus_821,821,bus,91,KCBT - KILAMBAKKAM To THIRUVANMIYUR,3
bus_828,828,bus,A1CT,M.G.R.CENTRAL To PALAVAKKAM,3
bus_829,829,bus,A1CT,M.G.R.CENTRAL To THIRUVALLUVAR NAGAR,3
bus_830,830,bus,S5CT,GOVT ESTATE METRO R.S To SECRETARIAT,3
bus_832,832,bus,A47,AVADI B.T To THIRUVANMIYUR B.T,3
bus_838,838,bus,S15,THIRUVANMIYUR DEPOT To I.I.T CORNER,3
bus_839,839,bus,S15,THIRUVANMIYUR RAILWAY STATION To MADHYA KAILASH,3
bus_841,841,bus,S95,VELACHERY To PERUNGUDI,3
bus_842,842,bus,S95,THIRUVANMIYUR To VELACHERY B.T,3
bus_844,844,bus,S98,LITTLE MOUNT METRO To TARAMANI B.T,3
bus_845,845,bus,S98CT,THIRUVANMIYUR To I.R.T. RD.JN,3
bus_846,846,bus,S15,THIRUVANMIYUR To MADHYAKAILASH,3
