route_id,original_route_id,mode,route_short_name,route_long_name,route_type
bus_3533,3533,bus,570,M.M.B.T To SIRUSERI I.T PARK,3
bus_3535,3535,bus,570C,KANNAGI NAGAR TNUHDB To M.G.R.KOYAMBEDU,3
bus_3536,3536,bus,570C,M.G.R.KOYAMBEDU To KANNAGI NAGAR TNUHDB,3
bus_3537,3537,bus,570C,KANNAGI NAGAR TNUHDB To VADAPALANI B.T,3
bus_3538,3538,bus,570C,VADAPALANI To KANNAGI NAGAR TNUHDB,3
bus_3539,3539,bus,570ET,ANNA NAGAR WEST To M.G.R.KOYAMBEDU,3
bus_3540,3540,bus,570ET,M.G.R.KOYAMBEDU To ANNA NAGAR WEST,3
bus_3541,3541,bus,570ET,M.G.R.KOYAMBEDU To K.K.NAGAR,3
bus_3542,3542,bus,570ET,K.K.NAGAR To M.G.R.KOYAMBEDU,3
bus_3543,3543,bus,570ET,M.G.R.KOYAMBEDU To SIRUSERI I.T PARK,3
bus_3545,3545,bus,570ET,M.G.R.KOYAMBEDU B.T To THIRUPORUR BUS STAND,3
bus_3546,3546,bus,570ET,THIRUPORUR BUS STAND To M.G.R.KOYAMBEDU B.T,3
bus_3547,3547,bus,570ET,SIRUSERI I.T PARK To PERUMBAKKAM TNUHDB,3
bus_3550,3550,bus,570ET,VELACHERY B.T To THIRUPORUR,3
bus_3551,3551,bus,570ET,THIRUPORUR To VELACHERY B.T,3
bus_3552,3552,bus,570P,KELAMBAKKAM To PERUMBAKKAM TNUHDB,3
bus_3554,3554,bus,570P,M.G.R.KOYAMBEDU To KELAMBAKKAM,3
bus_3555,3555,bus,570P,KELAMBAKKAM To M.G.R.KOYAMBEDU,3
bus_3556,3556,bus,570P,M.G.R.KOYAMBEDU B.T To Perumbakkam TNUHDB,3
bus_3557,3557,bus,570P,Perumbakkam TNUHDB To M.G.R.KOYAMBEDU B.T,3
bus_3558,3558,bus,570T,M.G.R.KOYAMBEDU To THALAMBUR,3
bus_3559,3559,bus,570T,THALAMBUR To M.G.R.KOYAMBEDU,3
bus_3560,3560,bus,572,AVADI B.T To THIRUVALLUR,3
bus_3561,3561,bus,572,THIRUVALLUR To AVADI B.T,3
bus_3564,3564,bus,572A,AVADI B.T To THIRUVALLUR COLLECTOR OFFICE,3
bus_3565,3565,bus,572A,THIRUVALLUR B.T To AVADI B.T,3
bus_3567,3567,bus,572K,KIZHANOOR To AMBATTUR I.E,3
bus_3568,3568,bus,572K,AMBATTUR I.E To THIRUVALLUR,3
bus_3570,3570,bus,572K,AVADI B.T To KIZHANOOR,3
bus_3571,3571,bus,572K,KIZHANOOR To AVADI B.T,3
bus_3572,3572,bus,572K,AVADI B.T To THIRUVALLUR,3
bus_3573,3573,bus,572K,THIRUVALLUR To AVADI B.T,3
bus_3574,3574,bus,578X,IYYAPPANTHANGAL To SUNGUVARCHATHIRAM,3
bus_3575,3575,bus,578X,SUNGUVARCHATHIRAM To IYYAPPANTHANGAL,3
bus_3576,3576,bus,578,POONAMALLEE B.T To SUNGUVARCHATRAM,3
bus_3577,3577,bus,578,SUNGUVARCHATRAM To POONAMALLEE B.T,3
bus_3578,3578,bus,578A,KUNDRATHUR B.T To SRIPERUMBUDUR BUS TERMINUS,3
bus_3579,3579,bus,578A,SRIPERUMBUDUR BUS TERMINUS To KUNDRATHUR B.T,3
bus_3580,3580,bus,578ET,IYYAPPANTHANGAL To KUNNAM,3
bus_3582,3582,bus,578ET,SUNGUVARCHATHIRAM To IYYAPPANTHANGAL,3
bus_3583,3583,bus,578ET,KUNNAM To POONAMALLEE B.T,3
bus_3584,3584,bus,578ET,POONAMALLEE B.T To SUNGUVARCHATHIRAM,3
bus_3585,3585,bus,578ET,SUNGUVARCHATHIRAM To POONAMALLEE B.T,3
bus_3586,3586,bus,578PCT,POONAMALLEE B.T To ELAMBAKKAM,3
bus_3587,3587,bus,578PCT,ELAMBAKKAM To POONAMALLEE B.T,3
bus_3588,3588,bus,578PCT,POONAMALLEE B.T To SUNGUVARCHATHIRAM,3
bus_3589,3589,bus,578PCT,SUNGUVARCHATHIRAM To POONAMALLEE B.T,3
bus_3590,3590,bus,579A,CHROMEPET NEHRU NAGAR To WALAJABAD B.T,3
bus_3591,3591,bus,579A,WALAJABAD To NEHRU NAGAR,3
bus_3592,3592,bus,579A,TAMBARAM SANATORIUM To ORAGADAM RD.JN,3
bus_3593,3593,bus,579A,ORAGADAM RD.JN To TAMBARAM SANATORIUM,3
bus_3594,3594,bus,579A,TAMBARAM SANATORIUM BUS STAND To WALAJABAD B.T,3
bus_3595,3595,bus,579A,WALAJABAD B.T To TAMBARAM SANATORIUM B.T,3
bus_3596,3596,bus,579C,TAMBARAM SANATORIUM To ORAGADAM,3
bus_3597,3597,bus,579C,ORAGADAM To TAMBARAM SANATORIUM,3
bus_3598,3598,bus,579C,TAMBARAM SANATORIUM BUS STAND To WALAJABAD B.T,3
bus_3599,3599,bus,579C,WALAJABAD B.T To TAMBARAM SANATORIUM B.T,3
bus_3602,3602,bus,579K,KILAMBAKKAM BUS TERMINUS To WALAJABAD B.T,3
bus_3603,3603,bus,579K,WALAJABAD B.T To KILAMBAKKAM BUS TERMINUS,3
bus_3604,3604,bus,579K,TAMBARAM WEST To KCBT - KILAMBAKKAM,3
bus_3605,3605,bus,579K,KCBT - KILAMBAKKAM To TAMBARAM WEST,3
bus_3606,3606,bus,57,MOOLAKADAI To REDHILLS BUS TERMINUS,3
bus_3610,3610,bus,57CT,VALLALAR NAGAR B.T To MOOLAKADAI,3
bus_3611,3611,bus,57CT,MOOLAKADAI To VALLALAR NAGAR,3
bus_3612,3612,bus,57,VALLALAR NAGAR B.T To REDHILLS BUS TERMINUS,3
bus_3613,3613,bus,57,REDHILLS BUS TERMINUS To VALLALAR NAGAR B.T,3
bus_3616,3616,bus,57A,ANGADU To REDHILLS,3
bus_3617,3617,bus,57A,REDHILLS To ANGADU,3
bus_3619,3619,bus,57A,VALLALAR NAGAR B.T To ANGADU,3
bus_3620,3620,bus,57A,ANGADU To VALLALAR NAGAR BUS TERMINUS,3
bus_3621,3621,bus,57B,REDHILLS To POTHUR,3
bus_3622,3622,bus,57B,POTHUR To REDHILLS,3
bus_3623,3623,bus,57B,REDHILLS To POTHUR,3
bus_3624,3624,bus,57B,POTHUR To REDHILLS,3
bus_3625,3625,bus,57C,REDHILLS To ARUMANDAI RD.JN.,3
bus_3626,3626,bus,57C,ARUMANDAI RD.JN. To REDHILLS,3
bus_3627,3627,bus,57C,REDHILLS To PADIYANALLUR,3
bus_3628,3628,bus,57C,PADIYANALLUR To REDHILLS,3
bus_3629,3629,bus,57C,VALLALAR NAGAR To ARUMANDAI RD.JN.,3
bus_3630,3630,bus,57C,ARUMANDAI RD.JN. To VALLALAR NAGAR,3
bus_3631,3631,bus,57C,REDHILLS To VALLALAR NAGAR,3
bus_3632,3632,bus,57CCT,REDHILLS BUS TERMINUS To GNAYARU,3
bus_3633,3633,bus,57CCT,GNAYARU To REDHILLS BUS TERMINUS,3
bus_3634,3634,bus,57D,BROADWAY To MOOLAKADAI,3
bus_3636,3636,bus,57D,BROADWAY To POOCHIATHIPEDU,3
bus_3637,3637,bus,57D,POOCHIATHIPEDU To BROADWAY,3
bus_3638,3638,bus,57D,MOOLAKADAI To ALAMATHI,3
bus_3640,3640,bus,57E,REDHILLS To PADIYANALLUR,3
bus_3641,3641,bus,57E,PADIYANALLUR To REDHILLS,3
bus_3642,3642,bus,57E,REDHILLS To VICHOOR,3
bus_3643,3643,bus,57E,VICHOOR To REDHILLS,3
bus_3644,3644,bus,57F,BROADWAY To KARANODAI,3
bus_3645,3645,bus,57F,KARANODAI To WAR MEMORIAL,3
bus_3648,3648,bus,57F,BROADWAY To MEL SURAPATTU,3
bus_3649,3649,bus,57F,KARANODAI To BROADWAY,3
bus_3650,3650,bus,57F,TRADE FAIR To MOOLAKADAI,3
bus_3651,3651,bus,57F,MOOLAKADAI To TRADE FAIR,3
bus_3652,3652,bus,57F,BROADWAY To PADIYANALLUR,3
bus_3656,3656,bus,57F,MOOLAKADAI To KARANODAI,3
bus_3657,3657,bus,57F,KARANODAI To MOOLAKADAI,3
bus_3658,3658,bus,57F,KARANODAI To REDHILLS,3
bus_3659,3659,bus,57F,REDHILLS To MEL SURAPATTU,3
bus_3661,3661,bus,57F,REDHILLS To PADIYANALLUR,3
bus_3662,3662,bus,57F,PADIYANALLUR To REDHILLS,3
bus_3663,3663,bus,57F,SECRETARIAT To KARANODAI,3
bus_3665,3665,bus,57F,VALLALAR NAGAR To KARANODAI,3
bus_3667,3667,bus,57F,VALLALAR NAGAR To MEL SURAPATTU,3
bus_3668,3668,bus,57F,KARANODAI To VALLALAR NAGAR BUS TERMINUS,3
bus_3669,3669,bus,57F,REDHILLS BUS TERMINUS To VALLALAR NAGAR BUS TERMINUS,3
bus_3670,3670,bus,57G,MOOLAKADAI To VAZHUTHALAMBEDU,3
bus_3671,3671,bus,57G,VAZHUTHIGAIMEDU To MOOLAKADAI,3
bus_3672,3672,bus,57G,REDHILLS BUS TERMINUS To VAZHUTHALAMBEDU,3
bus_3673,3673,bus,57G,VAZHUTHIGAIMEDU To REDHILLS,3
bus_3674,3674,bus,57H,BROADWAY To NEW ERUMAI VETTI PALAYAM BUS STAND,3
bus_3675,3675,bus,57H,NEW ERUMAI VETTI PALAYAM BUS STAND To BROADWAY,3
bus_3676,3676,bus,57H,BROADWAY To REDHILLS BUS TERMINUS,3
bus_3678,3678,bus,57H,NEW ERUMAIVETTI PALAYAM To KOYAMBEDU MARKET,3
bus_3679,3679,bus,57H,KOYAMBEDU MARKET To REDHILLS,3
bus_3681,3681,bus,57H,REDHILLS To NEW ERUMAIVETTI PALAYAM,3
bus_3682,3682,bus,57H,NEW ERUMAIVETTI PALAYAM To REDHILLS,3
bus_3683,3683,bus,57H,REDHILLS To PADIYANALLUR,3
bus_3684,3684,bus,57H,PADIYANALLUR To REDHILLS,3
bus_3685,3685,bus,57H,VALLALAR NAGAR BUS TERMINUS To NEW ERUMAI VETTI PALAYAM BUS STAND,3
bus_3686,3686,bus,57H,NEW ERUMAI VETTI PALAYAM BUS STAND To VALLALAR NAGAR BUS TERMINUS,3
bus_3687,3687,bus,57J,BROADWAY To GNAYARU,3
bus_3688,3688,bus,57J,GNAYARU To BROADWAY,3
bus_3689,3689,bus,57J,BROADWAY To REDHILLS BUS TERMINUS,3
bus_3691,3691,bus,57J,REDHILLS To GNAYARU,3
bus_3693,3693,bus,57M,BROADWAY To ALAMATHI,3
bus_3694,3694,bus,57M,ALAMATHI To BROADWAY,3
bus_3696,3696,bus,57M,REDHILLS To BROADWAY,3
bus_3697,3697,bus,57M,REDHILLS To ALAMATHI,3
bus_3698,3698,bus,57M,ALAMATHI To REDHILLS,3
bus_3699,3699,bus,57X,REDHILLS BUS TERMINUS To PERIYAPALAYAM B.T,3
bus_3700,3700,bus,57X,PERIYAPALAYAM B.T To REDHILLS BUS TERMINUS,3
bus_3703,3703,bus,57X,VALLALAR NAGAR B.T To PERIYAPALAYAM B.T,3
bus_3704,3704,bus,57X,PERIYAPALAYAM B.T To VALLALAR NAGAR BUS DEPOT,3
bus_3705,3705,bus,580,AVADI B.T To ARANI,3
bus_3706,3706,bus,580,ARANI To AVADI B.T,3
bus_3707,3707,bus,580,AVADI B.T To KALLUR,3
bus_3708,3708,bus,580,KALLUR To AVADI B.T,3
bus_3709,3709,bus,580,AVADI B.T To PERIYAPALAYAM B.T,3
bus_3710,3710,bus,580,PERIYAPALAYAM To AVADI B.T,3
bus_3714,3714,bus,580A,AVADI B.T To MEL SEMBEDU,3
bus_3715,3715,bus,580A,MEL SEMBEDU To AVADI B.T,3
bus_3718,3718,bus,580M,THIRUNINDRAVOOR To MALANTHUR,3
bus_3719,3719,bus,580M,MALANTHUR To THIRUNINRAVUR BUS TERMINUS,3
bus_3720,3720,bus,580S,AVADI B.T To SIRUVAPURI,3
bus_3721,3721,bus,580S,SIRUVAPURI To AVADI B.T,3
bus_3722,3722,bus,583,POONAMALLEE B.T To SRIPERUMBUDUR,3
bus_3723,3723,bus,583,SRIPERUMBUDUR To POONAMALLEE B.T,3
bus_3724,3724,bus,583,TAMBARAM SANATORIUM B.T To ORAGADAM ROAD JUNCTION,3
bus_3725,3725,bus,583,ORAGADAM ROAD JUNCTION To TAMBARAM SANATORIUM B.T,3
bus_3726,3726,bus,583,TAMBARAM SANATORIUM To SRIPERUMBUDUR,3
bus_3727,3727,bus,583,SRIPERUMBUDUR To TAMBARAM SANATORIUM,3
bus_3728,3728,bus,583A,POONAMALLEE B.T To SRIPERUMBUDUR,3
bus_3729,3729,bus,583A,SRIPERUMBUDUR To POONAMALLEE B.T,3
bus_3730,3730,bus,583A,POONAMALLEE B.T To THIRUVALLUR,3
bus_3731,3731,bus,583A,THIRUVALLUR To POONAMALLEE B.T,3
bus_3732,3732,bus,583A,THIRUVALLUR To SRIPERUMBUDUR BUS TERMINUS,3
bus_3733,3733,bus,583A,SRIPERUMBUDUR BUS TERMINUS To THIRUVALLUR,3
bus_3734,3734,bus,583C,TAMBARAM SANATORIUM To MANIMANGALAM,3
bus_3735,3735,bus,583C,MANIMANGALAM To TAMBARAM SANATORIUM,3
bus_3736,3736,bus,583C,TAMBARAM SANATORIUM BUS STAND To SRIPERUMBUDUR BUS TERMINUS,3
bus_3737,3737,bus,583C,SRIPERUMBUDUR BUS TERMINUS To TAMBARAM SANATORIUM B.T,3
bus_3738,3738,bus,583D,TAMBARAM SANATORIUM BUS STAND To SRIPERUMBUDUR BUS TERMINUS,3
bus_3739,3739,bus,583D,SRIPERUMBUDUR To TAMBARAM SANATORIUM,3
bus_3740,3740,bus,583K,KCBT - KILAMBAKKAM To NEHRU NAGAR,3
bus_3741,3741,bus,583K,NEHRU NAGAR To KCBT - KILAMBAKKAM,3
bus_3744,3744,bus,583K,KILAMBAKKAM BUS TERMINUS To SRIPERUMBUDUR BUS TERMINUS,3
bus_3745,3745,bus,583K,SRIPERUMBUDUR BUS TERMINUS To KILAMBAKKAM BUS TERMINUS,3
bus_3746,3746,bus,58V,MOOLAKADAI To M.G.R.KOYAMBEDU,3
bus_3748,3748,bus,58V,REDHILLS BUS TERMINUS To M.G.R.KOYAMBEDU B.T,3
bus_3749,3749,bus,58V,M.G.R.KOYAMBEDU B.T To REDHILLS BUS TERMINUS,3
bus_3750,3750,bus,58V,REDHILLS To MOOLAKADAI,3
bus_3752,3752,bus,591,POONAMALLEE B.T To OM MANGALAM VILLAGE,3
bus_3753,3753,bus,591,OM MANGALAM VILLAGE To POONAMALLEE B.T,3
bus_3754,3754,bus,591,POONAMALLEE B.T To PERAMBAKKAM,3
bus_3755,3755,bus,591,PERAMBAKKAM To POONAMALLEE B.T,3
bus_3756,3756,bus,591C,POONAMALLEE B.T To NARASINGAPURAM,3
bus_3757,3757,bus,591C,PERAMBAKKAM L.N.KOIL To POONAMALLEE B.T,3
bus_3758,3758,bus,592,REDHILLS To PADIYANALLUR,3
bus_3759,3759,bus,592,PADIYANALLUR To REDHILLS,3
bus_3760,3760,bus,592,REDHILLS BUS TERMINUS To UTHUKKOTTAI,3
bus_3761,3761,bus,592,UTHUKKOTTAI B.T To REDHILLS BUS TERMINUS,3
bus_3762,3762,bus,592V,REDHILLS To PADIYANALLUR,3
bus_3763,3763,bus,592V,PADIYANALLUR To REDHILLS,3
bus_3764,3764,bus,592V,REDHILLS To VENGAL,3
bus_3765,3765,bus,592V,VENGAL BAZAR To REDHILLS BUS TERMINUS,3
bus_3766,3766,bus,592V,VALLALAR NAGAR B.T To VENGAL BAZAR,3
bus_3767,3767,bus,592V,VENGAL BAZAR To VALLALAR NAGAR BUS TERMINUS,3
bus_3768,3768,bus,593CT,REDHILLS BUS TERMINUS To CHENNANG KARANAI,3
bus_3769,3769,bus,593CT,CHENNANG KARANAI To REDHILLS BUS TERMINUS,3
bus_3770,3770,bus,593CT,REDHILLS To PADIYANALLUR,3
bus_3771,3771,bus,593CT,PADIYANALLUR To REDHILLS,3
bus_3772,3772,bus,593CT,REDHILLS BUS TERMINUS To UTHUKKOTTAI,3
bus_3773,3773,bus,593CT,UTHUKKOTTAI B.T To REDHILLS BUS TERMINUS,3
bus_3774,3774,bus,595,MINJUR To PAZHAVERKADU L.H,3
bus_3775,3775,bus,595,PAZHAVERKADU L.H To MINJUR,3
bus_3778,3778,bus,595,THANGAL TOLLGATE To PAZHAVERKADU L.H,3
bus_3779,3779,bus,595,PAZHAVERKADU L.H To THANGAL TOLLGATE,3
bus_3780,3780,bus,597,THYAGARAYA NAGAR To K.K.NAGAR,3
bus_3781,3781,bus,597,K.K.NAGAR To THYAGARAYA NAGAR,3
bus_3782,3782,bus,597AC,IYYAPPANTHANGAL To THIRUVALLUR,3
bus_3783,3783,bus,597AC,THIRUVALLUR To IYYAPPANTHANGAL,3
bus_3784,3784,bus,597A,POONAMALLEE B.T To THIRUVALLUR,3
bus_3785,3785,bus,597A,THIRUVALLUR B.T To POONAMALLEE B.T,3
bus_3786,3786,bus,597ACT,THIRUVALLUR COLLECTOR OFFICE To POONAMALLEE B.T,3
bus_3787,3787,bus,597ACT,POONAMALLEE B.T To THIRUVALLUR,3
bus_3788,3788,bus,597ACT,THIRUVALLUR To POONAMALLEE B.T,3
bus_3789,3789,bus,597ACT,VELLAVEDU To THIRUVALLUR,3
bus_3790,3790,bus,597ACT,THIRUVALLUR To VELLAVEDU,3
bus_3791,3791,bus,597C,POONAMALLEE B.T To THIRUNINRAVUR RAILWAY STATION,3
bus_3792,3792,bus,597C,THIRUNINRAVUR RAILWAY STATION To POONAMALLEE B.T,3
bus_3793,3793,bus,597CET,PERIYA COLONY To AVADI B.T,3
bus_3794,3794,bus,597CET,AVADI B.T To THIRUNINRAVUR KOMATHI NAGAR,3
bus_3795,3795,bus,597CET,THIRUNINRAVUR KOMATHI NAGAR To THIRUNINRAVUR BUS TERMINUS,3
bus_3796,3796,bus,597CET,THIRUNINRAVUR BUS TERMINUS To THIRUNINRAVUR KOMATHI NAGAR,3
bus_3797,3797,bus,597CET,POONAMALLEE B.T To AVADI B.T,3
bus_3798,3798,bus,597CET,AVADI B.T To POONAMALLEE B.T,3
bus_3799,3799,bus,597CET,POONAMALLEE B.T To THIRUNINRAVUR BUS TERMINUS,3
bus_3800,3800,bus,597CET,THIRUNINRAVUR BUS TERMINUS To POONAMALLEE B.T,3
bus_3801,3801,bus,59,VALLALAR NAGAR BUS TERMINUS To THIRUVERKADU B.T,3
bus_3802,3802,bus,59,THIRUVERKADU B.T To VALLALAR NAGAR B.T,3
bus_3803,3803,bus,5E,BROADWAY To M.G.R.KOYAMBEDU,3
bus_3804,3804,bus,5E,M.G.R.KOYAMBEDU B.T To BROADWAY,3
bus_3805,3805,bus,5E,VADAPALANI To M.G.R.KOYAMBEDU,3
bus_3806,3806,bus,5E,M.G.R.KOYAMBEDU To VADAPALANI,3
bus_3807,3807,bus,5G,THYAGARAYA NAGAR BUS TERMINUS To KANNAGI NAGAR B.T,3
bus_3808,3808,bus,5G,KANNAGI NAGAR B.T To THYAGARAYA NAGAR BURKIT ROAD,3
bus_3811,3811,bus,5GCT,VELACHERY B.T To KANNAGI NAGAR TNUHDB,3
bus_3812,3812,bus,5GCT,KANNAGI NAGAR TNUHDB To VELACHERY B.T,3
bus_3813,3813,bus,5S,SAIDAPET METRO To KANNAGI NAGAR B.T,3
bus_3814,3814,bus,5S,KANNAGI NAGAR B.T To SAIDAPET,3
bus_3817,3817,bus,60,ANAKAPUTHUR To CHROMEPET,3
bus_3818,3818,bus,60,CHROMEPET To ANAKAPUTHUR,3
bus_3819,3819,bus,60,BROADWAY To ANAKAPUTHUR,3
bus_3820,3820,bus,60,ANAKAPUTHUR AMMAN TEMPLE To BROADWAY,3
bus_3821,3821,bus,60,SAIDAPET To ANAKAPUTHUR,3
bus_3822,3822,bus,60,ANAKAPUTHUR AMMAN TEMPLE To SAIDAPET,3
bus_3823,3823,bus,60A,BROADWAY To KUNDRATHUR,3
bus_3824,3824,bus,60A,KUNDRATHUR To BROADWAY,3
bus_3825,3825,bus,60A,BROADWAY To KUNDRATHUR B.T,3
bus_3826,3826,bus,60A,KUNDRATHUR B.T To BROADWAY,3
bus_3827,3827,bus,60A,NEHRU NAGAR To BROADWAY,3
bus_3828,3828,bus,60A,KUNDRATHUR B.T To NEHRU NAGAR,3
bus_3829,3829,bus,60D,BROADWAY To PAMMAL KAMARAJAPURAM,3
bus_3830,3830,bus,60D,PAMMAL KAMARAJAPURAM To BROADWAY,3
bus_3831,3831,bus,60D,GUDUVANCHERY To HASTHINAPURAM,3
bus_3832,3832,bus,60D,PAMMAL KAMARAJAPURAM To GUDUVANCHERI B.T,3
bus_3833,3833,bus,60D,GUDUVANCHERY To PAMMAL KAMARAJAPURAM,3
bus_3834,3834,bus,60D,HASTHINAPURAM To PAMMAL KAMARAJAPURAM,3
bus_3835,3835,bus,60E,BROADWAY To KUNDRATHUR,3
bus_3836,3836,bus,60E,KUNDRATHUR To BROADWAY,3
bus_3837,3837,bus,60E,BROADWAY To KUNDRATHUR B.T,3
bus_3838,3838,bus,60E,KUNDRATHUR B.T To BROADWAY,3
bus_3839,3839,bus,60G,BROADWAY To POZHICHALUR,3
bus_3840,3840,bus,60G,POZHICHALUR To BROADWAY,3
bus_3843,3843,bus,60H,BROADWAY To PAMMAL SRI SANKARA HEALTH CENTRE,3
bus_3844,3844,bus,60H,PAMMAL SRI SANKARA HEALTH CENTRE To BROADWAY,3
bus_3845,3845,bus,60H,HASTHINAPURAM To GUDUVANCHERY,3
bus_3847,3847,bus,60H,SANKARA HEALTH CENTRE To GUDUVANCHERY,3
bus_3848,3848,bus,60H,GUDUVANCHERY To SANKARA HEALTH CENTRE,3
bus_3849,3849,bus,60H,SANKARA HEALTH CENTRE To HASTHINAPURAM,3
bus_3851,3851,bus,61A,AVADI B.T To MELAPPEDU,3
bus_3852,3852,bus,61A,MELAPPEDU To AVADI B.T,3
bus_3853,3853,bus,61C,AVADI B.T To CRPF CO OP SHOP,3
bus_3854,3854,bus,61C,CRPF CO OP SHOP To AVADI B.T,3
bus_3855,3855,bus,61C,AVADI B.T To ELLA AMMAN NAGAR,3
bus_3856,3856,bus,61C,ELLA AMMAN NAGAR To AVADI B.T,3
bus_3857,3857,bus,61E,AVADI B.T To KILKONDAIYUR,3
bus_3858,3858,bus,61E,KILKONDAIYUR To AVADI B.T,3
bus_3859,3859,bus,61EX,KOYAMBEDU MARKET To KILKONDAIYUR,3
bus_3860,3860,bus,61EX,KILKONDAIYUR To KOYAMBEDU MARKET,3
bus_3861,3861,bus,61K,AVADI B.T To KANNIAMMAN NAGAR AVADI,3
bus_3862,3862,bus,61K,KANNIAMMAN NAGAR AVADI To AVADI B.T,3
bus_3863,3863,bus,61K,AVADI B.T To VEERAPURAM GOVT SCHOOL,3
bus_3864,3864,bus,61K,VEERAPURAM GOVT SCHOOL To AVADI B.T,3
bus_3865,3865,bus,61R,AVADI B.T To REDHILLS BUS TERMINUS,3
bus_3866,3866,bus,61R,REDHILLS To AVADI B.T,3
bus_3867,3867,bus,61R,REDHILLS To PADIYANALLUR,3
bus_3868,3868,bus,61R,PADIYANALLUR To REDHILLS,3
bus_3869,3869,bus,62,AVADI B.T To REDHILLS BUS TERMINUS,3
bus_3870,3870,bus,62,REDHILLS To AVADI B.T,3
bus_3871,3871,bus,62,M.K.B.NAGAR To REDHILLS,3
bus_3872,3872,bus,62,REDHILLS To M.K.B.NAGAR,3
bus_3873,3873,bus,62,MOOLAKADAI To REDHILLS,3
bus_3874,3874,bus,62,REDHILLS BUS TERMINUS To MOOLAKADAI,3
bus_3875,3875,bus,62,POONAMALLEE B.T To AMBATTUR INDUSTRIAL ESTATE B.T,3
bus_3876,3876,bus,62,AMBATTUR INDUSTRIAL ESTATE B.T To POONAMALLEE B.T,3
bus_3877,3877,bus,62,POONAMALLEE B.T To AVADI B.T,3
bus_3878,3878,bus,62,AVADI B.T To POONAMALLEE B.T,3
bus_3879,3879,bus,62,POONAMALLEE B.T To REDHILLS BUS TERMINUS,3
bus_3880,3880,bus,62,REDHILLS BUS TERMINUS To POONAMALLEE B.T,3
bus_3881,3881,bus,62,REDHILLS To PADIYANALLUR,3
bus_3882,3882,bus,62,PADIYANALLUR To REDHILLS,3
bus_3883,3883,bus,62A,PUZHAL To AMBATTUR I.E,3
bus_3884,3884,bus,62A,AMBATTUR I.E To PUZHAL,3
bus_3885,3885,bus,62A,REDHILLS BUS TERMINUS To AMBATTUR INDUSTRIAL ESTATE B.T,3
bus_3886,3886,bus,62A,AMBATTUR INDUSTRIAL ESTATE B.T To REDHILLS BUS TERMINUS,3
bus_3887,3887,bus,62B,AMBATTUR I.E To J.J.NAGAR WEST,3
bus_3888,3888,bus,62B,J.J.NAGAR WEST To AMBATTUR I.E,3
bus_3889,3889,bus,62B,REDHILLS To J.J.NAGAR WEST,3
bus_3890,3890,bus,62B,J.J.NAGAR WEST To REDHILLS,3
bus_3891,3891,bus,62CT,AVADI B.T To REDHILLS BUS TERMINUS,3
bus_3892,3892,bus,62CT,REDHILLS BUS TERMINUS To AVADI B.T,3
bus_3893,3893,bus,62CT,MOOLAKADAI To REDHILLS,3
bus_3894,3894,bus,62CT,REDHILLS To MOOLAKADAI,3
bus_3895,3895,bus,62M,M.M.B.T To MADHAVARAM,3
bus_3896,3896,bus,62M,MADHAVARAM To M.M.B.T,3
bus_3897,3897,bus,62M,POONAMALLEE B.T To M.M.B.T,3
bus_3898,3898,bus,62M,M.M.B.T To POONAMALLEE B.T,3
bus_3899,3899,bus,63,AMBATTUR I.E To THIRUVERKADU,3
bus_3901,3901,bus,63,I.C.F To AMBATTUR I.E,3
bus_3902,3902,bus,63,AMBATTUR I.E To I.C.F,3
bus_3904,3904,bus,63,THIRUVERKADU To I.C.F,3
bus_3905,3905,bus,63CT,AMBATTUR I.E To THIRUVERKADU,3
bus_3906,3906,bus,63CT,THIRUVERKADU To AMBATTUR I.E,3
bus_3907,3907,bus,64C,AZEEZEE NAGAR To BROADWAY,3
bus_3908,3908,bus,64C,BROADWAY To MOOLAKADAI,3
bus_3909,3909,bus,64C,MOOLAKADAI To BROADWAY,3
bus_3910,3910,bus,64C,BROADWAY To MANALI B.T,3
bus_3911,3911,bus,64C,MANALI B.T To BROADWAY,3
bus_3912,3912,bus,64C,MANJAMPAKKAM To BROADWAY,3
bus_3913,3913,bus,64C,MOOLAKADAI To MANALI,3
bus_3914,3914,bus,64C,MANALI To MOOLAKADAI,3
bus_3915,3915,bus,64D,BROADWAY To KOSAPPUR BUS STAND,3
bus_3916,3916,bus,64D,KOSAPPUR BUS STAND To BROADWAY,3
bus_3917,3917,bus,64D,BROADWAY To MOOLAKADAI,3
bus_3918,3918,bus,64D,MOOLAKADAI To BROADWAY,3
bus_3919,3919,bus,64D,MOOLAKADAI To KOSAPPUR,3
bus_3920,3920,bus,64D,KOSAPPUR To MOOLAKADAI,3
bus_3921,3921,bus,64K,BROADWAY To KAVIARASU KANNADASAN NAGAR B.T,3
bus_3922,3922,bus,64K,KAVIARASU KANNADASAN NAGAR B.T To BROADWAY,3
bus_3923,3923,bus,64KCT,PERAMBUR B.T To KAVIARASU KANNADASAN NAGAR B.T,3
bus_3924,3924,bus,64K,KAVIARASU KANNADASAN NAGAR B.T To PERAMBUR B.T,3
bus_3925,3925,bus,64KET,BROADWAY To K.KANNADASAN NAGAR,3
bus_3926,3926,bus,64KET,K.KANNADASAN NAGAR To BROADWAY,3
bus_3927,3927,bus,64KET,BROADWAY To KODUNGAIYUR PARVATHI NAGAR,3
bus_3928,3928,bus,64KET,KODUNGAIYUR PARVATHI NAGAR To BROADWAY,3
bus_3929,3929,bus,64KET,PERAMBUR B.T To K.KANNADASAN NAGAR,3
bus_3930,3930,bus,64KET,K.KANNADASAN NAGAR To PERAMBUR B.T,3
bus_3931,3931,bus,64M,M.G.R.CENTRAL R.S To M.M.B.T,3
bus_3932,3932,bus,64M,M.M.B.T To M.G.R.CENTRAL R.S,3
bus_3937,3937,bus,65A,THYAGARAYA NAGAR To POONAMALLEE B.T,3
bus_3938,3938,bus,65A,POONAMALLEE B.T To THYAGARAYA NAGAR,3
bus_3939,3939,bus,65B,MUTHAPUDUPET To AMBATTUR INDUSTRIAL ESTATE B.T,3
bus_3940,3940,bus,65B,AMBATTUR I.E To MUTHAPUDUPET,3
bus_3941,3941,bus,65B,POONAMALLEE B.T To AMBATTUR INDUSTRIAL ESTATE B.T,3
bus_3942,3942,bus,65B,AMBATTUR INDUSTRIAL ESTATE B.T To POONAMALLEE B.T,3
bus_3943,3943,bus,65CCT,AMBATTUR INDUSTRIAL ESTATE B.T To PAKKAM VILLAGE,3
bus_3944,3944,bus,65CCT,PAKKAM VILLAGE To AMBATTUR INDUSTRIAL ESTATE B.T,3
bus_3949,3949,bus,65E,AVADI B.T To POONAMALLEE B.T,3
bus_3950,3950,bus,65E,POONAMALLEE B.T To AVADI B.T,3
bus_3953,3953,bus,65G,THAMARAIPAKKAM To MEYYUR,3
bus_3954,3954,bus,65G,MEYYUR To THAMARAIPAKKAM JUNCTION,3
bus_3959,3959,bus,65K,POONAMALLEE B.T To AVADI B.T,3
bus_3960,3960,bus,65K,AVADI B.T To POONAMALLEE B.T,3
bus_3961,3961,bus,66,TAMBARAM WEST BUS STAND To POONAMALLEE B.T,3
bus_3962,3962,bus,66,POONAMALLEE B.T To TAMBARAM WEST BUS STAND,3
bus_3963,3963,bus,66A,HASTHINAPURAM B.T To KUNDRATHUR B.T,3
bus_3964,3964,bus,66A,KUNDRATHUR B.T To HASTHINAPURAM B.T,3
bus_3965,3965,bus,66J,CHROMEPET To POONAMALLEE B.T,3
bus_3966,3966,bus,66J,POONAMALLEE B.T To CHROMEPET,3
bus_3967,3967,bus,66J,TAMBARAM WEST To POONAMALLEE B.T,3
bus_3968,3968,bus,66J,POONAMALLEE B.T To TAMBARAM WEST,3
bus_3969,3969,bus,66K,KCBT - KILAMBAKKAM To KUNDRATHUR,3
bus_3970,3970,bus,66K,KUNDRATHUR To KCBT - KILAMBAKKAM,3
bus_3971,3971,bus,66K,KILAMBAKKAM BUS TERMINUS To KUNDRATHUR B.T,3
bus_3972,3972,bus,66K,KUNDRATHUR B.T To KILAMBAKKAM BUS TERMINUS,3
bus_3973,3973,bus,66KX,KCBT - KILAMBAKKAM To NEHRU NAGAR,3
bus_3974,3974,bus,66KX,NEHRU NAGAR To KCBT - KILAMBAKKAM,3
bus_3975,3975,bus,66K,KCBT - KILAMBAKKAM To TAMBARAM WEST,3
bus_3976,3976,bus,66K,TAMBARAM WEST To KCBT - KILAMBAKKAM,3
bus_3977,3977,bus,66KCT,NEHRU NAGAR To KUNDRATHUR B.T,3
bus_3978,3978,bus,66KCT,KUNDRATHUR B.T To NEHRU NAGAR,3
bus_3979,3979,bus,66KCT,TAMBARAM WEST BUS STAND To KUNDRATHUR B.T,3
bus_3980,3980,bus,66KCT,KUNDRATHUR B.T To TAMBARAM WEST BUS STAND,3
bus_3981,3981,bus,66P,KCBT - KILAMBAKKAM To KUNDRATHUR B.T,3
bus_3982,3982,bus,66P,KUNDRATHUR B.T To KCBT - KILAMBAKKAM,3
bus_3983,3983,bus,66P,KILAMBAKKAM BUS TERMINUS To POONAMALLEE B.T,3
bus_3984,3984,bus,66P,POONAMALLEE B.T To KILAMBAKKAM BUS TERMINUS,3
bus_3985,3985,bus,66P,KCBT - KILAMBAKKAM To TAMBARAM WEST,3
bus_3986,3986,bus,66P,TAMBARAM WEST To KCBT - KILAMBAKKAM,3
bus_3987,3987,bus,66P,TAMBARAM WEST To POONAMALLEE B.T,3
bus_3988,3988,bus,66P,POONAMALLEE B.T To TAMBARAM WEST,3
bus_3989,3989,bus,66X,GUDUVANCHERY To KCBT - KILAMBAKKAM,3
bus_3990,3990,bus,66X,KCBT - KILAMBAKKAM To GUDUVANCHERY,3
bus_3991,3991,bus,66X,GUDUVANCHERY To POONAMALLEE B.T,3
bus_3992,3992,bus,66X,POONAMALLEE B.T To GUDUVANCHERY,3
bus_3993,3993,bus,6DET,SATHUMA NAGAR To FORESHORE ESTATE,3
bus_3994,3994,bus,6DET,FORESHORE ESTATE To SATHUMA NAGAR,3
bus_3995,3995,bus,6DET,SATHUMA NAGAR To THIRUVANMIYUR,3
bus_3996,3996,bus,6DET,THIRUVANMIYUR To SATHUMA NAGAR,3
bus_3997,3997,bus,6DET,THANGAL TOLLGATE To THIRUVANMIYUR,3
bus_3998,3998,bus,6DET,THIRUVANMIYUR To THANGAL TOLLGATE,3
bus_3999,3999,bus,70,AVADI B.T To TAMBARAM WEST BUS STAND,3
bus_4000,4000,bus,70,TAMBARAM WEST BUS STAND To AVADI B.T,3
bus_4001,4001,bus,70,M.G.R.KOYAMBEDU To TAMBARAM WEST,3
bus_4002,4002,bus,70,TAMBARAM WEST To M.G.R.KOYAMBEDU,3
bus_4003,4003,bus,70,VADAPALANI To AVADI B.T,3
bus_4005,4005,bus,70,TAMBARAM WEST To VADAPALANI B.T,3
bus_4006,4006,bus,70AC,AMBATTUR I.E To KOYAMBEDU MARKET,3
bus_4008,4008,bus,70AC,AMBATTUR I.E To M.G.R.KOYAMBEDU,3
bus_4009,4009,bus,70AC,M.G.R.KOYAMBEDU To AMBATTUR I.E,3
bus_4010,4010,bus,70AC,AVADI B.T To AMBATTUR I.E,3
bus_4012,4012,bus,70A,AVADI B.T To M.G.R.KOYAMBEDU B.T,3
bus_4013,4013,bus,70A,M.G.R.KOYAMBEDU B.T To AVADI B.T,3
bus_4014,4014,bus,70AX,KOYAMBEDU MARKET To REDHILLS,3
bus_4015,4015,bus,70AX,REDHILLS To M.G.R.KOYAMBEDU,3
bus_4017,4017,bus,70ACT,AMBATTUR I.E To M.G.R.KOYAMBEDU,3
bus_4018,4018,bus,70ACT,M.G.R.KOYAMBEDU To AMBATTUR I.E,3
bus_4021,4021,bus,70ACT,AVADI B.T To M.G.R.KOYAMBEDU,3
bus_4022,4022,bus,70ACT,M.G.R.KOYAMBEDU To AVADI B.T,3
bus_4024,4024,bus,70ACT,AMBATTUR I.E To SENTHIL NAGAR,3
bus_4025,4025,bus,70ACT,SENTHIL NAGAR To KOYAMBEDU MARKET,3
bus_4026,4026,bus,70ACT,KOYAMBEDU MARKET To SENTHIL NAGAR,3
bus_4027,4027,bus,70ACT,SENTHIL NAGAR To M.G.R.KOYAMBEDU,3
bus_4028,4028,bus,70ACT,M.G.R.KOYAMBEDU To SENTHIL NAGAR,3
bus_4031,4031,bus,70C,TAMBARAM WEST To K.K.NAGAR B.T,3
bus_4032,4032,bus,70C,KCBT - KILAMBAKKAM To K.K.NAGAR,3
bus_4033,4033,bus,70C,K.K.NAGAR B.T To KOYAMBEDU MARKET,3
bus_4036,4036,bus,70C,K.K.NAGAR B.T To M.G.R.KOYAMBEDU,3
bus_4037,4037,bus,70C,KILAMBAKKAM BUS TERMINUS To M.G.R.KOYAMBEDU B.T,3
bus_4038,4038,bus,70C,NAVALUR TNUHDB To KOYAMBEDU MARKET,3
bus_4039,4039,bus,70C,VADAPALANI To M.G.R.KOYAMBEDU,3
bus_4040,4040,bus,70C,VADAPALANI To KOYAMBEDU MARKET,3
bus_4041,4041,bus,70C,LITTLE FLOWER CONVENT To TAMBARAM WEST,3
bus_4043,4043,bus,70C,NATTARASANPATTU To TAMBARAM WEST,3
bus_4044,4044,bus,70C,TAMBARAM WEST To NATTARASANPATTU,3
bus_4045,4045,bus,70C,TAMBARAM WEST To NAVALUR TNUHDB,3
bus_4047,4047,bus,70C,VADAPALANI To KCBT - KILAMBAKKAM,3
bus_4049,4049,bus,70C,TAMBARAM WEST To VADAPALANI B.T,3
bus_4051,4051,bus,70C,TAMBARAM WEST To VADAPALANI,3
bus_4052,4052,bus,70CET,KCBT - KILAMBAKKAM To K.K.NAGAR,3
bus_4053,4053,bus,70CET,K.K.NAGAR To KCBT - KILAMBAKKAM,3
bus_4054,4054,bus,70E,AYANAVARAM B.T To KCBT - KILAMBAKKAM,3
bus_4055,4055,bus,70E,KCBT - KILAMBAKKAM To AYANAVARAM B.T,3
bus_4056,4056,bus,70E,M.G.R.KOYAMBEDU To KCBT - KILAMBAKKAM,3
bus_4057,4057,bus,70E,KCBT - KILAMBAKKAM To M.G.R.KOYAMBEDU,3
bus_4058,4058,bus,70E,VYASARPADI M K B AMBEDKAR To KILAMBAKKAM BUS TERMINUS,3
bus_4059,4059,bus,70E,KILAMBAKKAM BUS TERMINUS To M.K.B.NAGAR,3
bus_4060,4060,bus,70F,M.G.R.KOYAMBEDU To KCBT - KILAMBAKKAM,3
bus_4061,4061,bus,70F,KILAMBAKKAM BUS TERMINUS To M.G.R.KOYAMBEDU B.T,3
bus_4062,4062,bus,70F,MADHAVARAM VILLAGE BUS STAND To KILAMBAKKAM BUS TERMINUS,3
bus_4063,4063,bus,70F,KILAMBAKKAM BUS TERMINUS To MADHAVARAM VILLAGE BUS STAND,3
bus_4064,4064,bus,70F,MADHAVARAM B.T To MADHAVARAM,3
bus_4065,4065,bus,70F,MADHAVARAM To MADHAVARAM B.T,3
bus_4070,4070,bus,70G,VADAPALANI BUS STAND To GUDUVANCHERI B.T,3
