route_id,original_route_id,mode,route_short_name,route_long_name,route_type
bus_5195,5195,bus,M51VC,POLACHERI KOLATHUR To MEDAVAKKAM JUNCTION,3
bus_5197,5197,bus,MSTBR1,BROADWAY To BROADWAY,3
bus_5198,5198,bus,MSTCL1,M.G.R.CENTRAL To M.G.R.CENTRAL,3
bus_5199,5199,bus,M70,THIRUVANMIYUR To K.K.NAGAR,3
bus_5200,5200,bus,29NET,PERAVALLUR KUMARAN NAGAR To SAIDAPET,3
bus_5201,5201,bus,29NET,SAIDAPET To PERAVALLUR KUMARAN NAGAR,3
bus_5202,5202,bus,159ACT,TONDIARPET To M.G.R.KOYAMBEDU,3
bus_5203,5203,bus,159ACT,M.G.R.KOYAMBEDU To TONDIARPET,3
bus_5204,5204,bus,159CT,TONDIARPET To THIRUVERKADU,3
bus_5205,5205,bus,159CT,THIRUVERKADU To TONDIARPET,3
bus_5206,5206,bus,18DCT,MADIPAKKAM B.T To N.G.O.COLONY,3
bus_5208,5208,bus,18DCT,N.G.O.COLONY To BROADWAY,3
bus_5209,5209,bus,18DCT,BROADWAY To N.G.O.COLONY,3
bus_5210,5210,bus,MSTTA1,TAMBARAM WEST To TAMBARAM WEST,3
bus_5211,5211,bus,MSTPM1,POONAMALLEE B.T To POONAMALLEE B.T,3
bus_5213,5213,bus,MSTTR1,THIRUVANMIYUR To THIRUVANMIYUR,3
bus_5214,5214,bus,MSTRH1,REDHILLS To REDHILLS,3
bus_5215,5215,bus,MSTVC1,VELACHERY B.T To VELACHERY B.T,3
bus_5216,5216,bus,MSTGU1,GUINDY TVK ESTATE To GUINDY TVK ESTATE,3
bus_5217,5217,bus,MSTCM1,M.G.R.KOYAMBEDU To M.G.R.KOYAMBEDU,3
bus_5218,5218,bus,MSTAV1,AVADI B.T To AVADI B.T,3
bus_5219,5219,bus,MSTTN1,THYAGARAYA NAGAR To THYAGARAYA NAGAR,3
bus_5220,5220,bus,MSTAI1,AMBATTUR I.E To AMBATTUR I.E,3
bus_5221,5221,bus,MSTAD1,ADYAR B.T To ADYAR B.T,3
bus_5222,5222,bus,MSTIY1,IYYAPPANTHANGAL To IYYAPPANTHANGAL,3
bus_5223,5223,bus,MSTKB1,KCBT - KILAMBAKKAM To KCBT - KILAMBAKKAM,3
bus_5224,5224,bus,MSTVP1,VADAPALANI To VADAPALANI,3
bus_5225,5225,bus,MSTAO1,AMBATTUR O.T To AMBATTUR O.T,3
bus_5226,5226,bus,MSTIY2,SRIPERUMBUDUR To SRIPERUMBUDUR,3
bus_5227,5227,bus,MSTPR1,PERAMBUR B.T To PERAMBUR B.T,3
bus_5228,5228,bus,MSTSP1,SAIDAPET To SAIDAPET,3
bus_5229,5229,bus,21LET,MADIPAKKAM B.T To BROADWAY,3
bus_5230,5230,bus,21LET,BROADWAY To MADIPAKKAM B.T,3
bus_5231,5231,bus,49F,GUINDY TVK ESTATE To MANDAVELI,3
bus_5232,5232,bus,49F,MANDAVELI To GUINDY TVK ESTATE,3
bus_5233,5233,bus,109TCT,M.G.R.CENTRAL To THIRUVOTRIYUR B.T,3
bus_5234,5234,bus,758,M.G.R.KOYAMBEDU To M.G.R.KOYAMBEDU,3
bus_5237,5237,bus,588CT,KELAMBAKKAM To MAMALLAPURAM,3
bus_5238,5238,bus,588CT,MAMALLAPURAM To KELAMBAKKAM,3
bus_5239,5239,bus,588CT,PERUMBAKKAM TNUHDB To MAMALLAPURAM,3
bus_5240,5240,bus,588CT,MAMALLAPURAM To PERUMBAKKAM TNUHDB,3
bus_5243,5243,bus,S30K,KOTTURPURAM R.S To GUINDY B.T,3
bus_5244,5244,bus,S30K,GUINDY TVK ESTATE To KOTTURPURAM R.S,3
bus_5245,5245,bus,S30K,THYAGARAYA NAGAR To KOTTURPURAM R.S,3
bus_5246,5246,bus,S30K,KOTTURPURAM R.S To THYAGARAYA NAGAR,3
bus_5247,5247,bus,M88,KUNDRATHUR DEPOT To VADAPALANI B.T,3
bus_5248,5248,bus,M88,VADAPALANI B.T To KUNDRATHUR DEPOT,3
bus_5249,5249,bus,21GCT,TAMBARAM To RAJAJI BHAVAN,3
bus_5250,5250,bus,21GCT,RAJAJI BHAVAN To TAMBARAM,3
bus_5259,5259,bus,157CT,REDHILLS To TONDIARPET,3
bus_5260,5260,bus,157CT,TONDIARPET To REDHILLS,3
bus_5263,5263,bus,C2,SECRETARIAT To SECRETARIAT,3
bus_5264,5264,bus,99C,CHROMEPET-II To SEMMANCHERI TNUHDB,3
bus_5265,5265,bus,99C,SEMMANCHERI TNUHDB To CHROMEPET-II,3
bus_5266,5266,bus,11SEC,BROADWAY To THYAGARAYA NAGAR,3
bus_5268,5268,bus,63,I.C.F To THIRUVERKADU,3
bus_5269,5269,bus,63,THIRUVERKADU To I.C.F,3
bus_5272,5272,bus,15G,BROADWAY To M.G.R.KOYAMBEDU,3
bus_5275,5275,bus,54SCT,SAIDAPET To PORUR,3
bus_5276,5276,bus,54SCT,PORUR To SAIDAPET,3
bus_5277,5277,bus,54SCT,VADAKKU MALAIAMBAKKAM To POONAMALLEE B.T,3
bus_5278,5278,bus,21X,BROADWAY To ADYAR DEPOT,3
bus_5279,5279,bus,12B,VADAPALANI To FORESHORE ESTATE,3
bus_5280,5280,bus,12B,FORESHORE ESTATE To VADAPALANI,3
bus_5281,5281,bus,6A,SATHUMA NAGAR To ANNA SQUARE,3
bus_5282,5282,bus,6A,ANNA SQUARE To SATHUMA NAGAR,3
bus_5286,5286,bus,166A,PAZHANTHANDALAM To IYYAPPANTHANGAL,3
bus_5287,5287,bus,166A,IYYAPPANTHANGAL To PAZHANTHANDALAM,3
bus_5289,5289,bus,55K,KCBT - KILAMBAKKAM To MURUGAMANGALAM TNUHDB,3
bus_5290,5290,bus,55K,MURUGAMANGALAM TNUHDB To KCBT - KILAMBAKKAM,3
bus_5291,5291,bus,M51DCT,SAIDAPET To PUDUPAKKAM RD.JN,3
bus_5292,5292,bus,M51DCT,PUDUPAKKAM RD.JN To SAIDAPET,3
bus_5293,5293,bus,M51DCT,PUDUPAKKAM RD.JN To VELACHERY B.T,3
bus_5299,5299,bus,1C,ENNORE To TONDIARPET,3
bus_5304,5304,bus,102KCT,KANNAGI NAGAR TNUHDB To YMCA HR.SCHOOL,3
bus_5305,5305,bus,102KCT,YMCA HR.SCHOOL To ADYAR B.T,3
bus_5306,5306,bus,102KCT,ADYAR B.T To YMCA HR.SCHOOL,3
bus_5307,5307,bus,S95CT,THARAMANI KALLUKUTTAI To YMCA HR.SCHOOL,3
bus_5308,5308,bus,102KCT,YMCA HR.SCHOOL To KANNAGI NAGAR TNUHDB,3
bus_5323,5323,bus,S95CT,YMCA HR.SCHOOL To THARAMANI KALLUKUTTAI,3
bus_5324,5324,bus,S95CT,THIRUVANMIYUR To THARAMANI KALLUKUTTAI,3
bus_5325,5325,bus,S95CT,VELACHERY B.T To YMCA HR.SCHOOL,3
bus_5326,5326,bus,S95CT,YMCA HR.SCHOOL To VELACHERY B.T,3
bus_5327,5327,bus,S95CT,THARAMANI KALLUKUTTAI To VELACHERY B.T,3
bus_5328,5328,bus,S23,IYYAPPANTHANGAL To KUMANANCHAVADI,3
bus_5329,5329,bus,S23,KUMANANCHAVADI To IYYAPPANTHANGAL,3
bus_5338,5338,bus,54T,THYAGARAYA NAGAR To CHEMBARAMBAKKAM,3
bus_5339,5339,bus,54T,CHEMBARAMBAKKAM To THYAGARAYA NAGAR,3
bus_5340,5340,bus,A51CT,BROADWAY To VELACHERY B.T,3
bus_5341,5341,bus,E51CT,VELACHERY B.T To SAIDAPET,3
bus_5343,5343,bus,E51CT,VELACHERY B.T To OTTIYAMPAKKAM,3
bus_5344,5344,bus,E51CT,OTTIYAMPAKKAM To VELACHERY B.T,3
bus_5345,5345,bus,815,BROADWAY To CHENGALPET,3
bus_5347,5347,bus,18CT,CEMENT ROAD To KCBT - KILAMBAKKAM,3
bus_5348,5348,bus,18CT,KCBT - KILAMBAKKAM To CEMENT ROAD,3
bus_5349,5349,bus,18CT,SAIDAPET To KCBT - KILAMBAKKAM,3
bus_5350,5350,bus,18CT,KCBT - KILAMBAKKAM To SAIDAPET,3
bus_5351,5351,bus,18CT,KCBT - KILAMBAKKAM To THIRUVANMIYUR,3
bus_5352,5352,bus,18CT,THIRUVANMIYUR To KCBT - KILAMBAKKAM,3
bus_5358,5358,bus,70CCT,M.G.R.KOYAMBEDU To VADAPALANI,3
bus_5359,5359,bus,70C CT,M.G.R.KOYAMBEDU To TAMBARAM WEST,3
bus_5360,5360,bus,70C CT,TAMBARAM WEST To M.G.R.KOYAMBEDU,3
bus_5363,5363,bus,70C CT,M.G.R.KOYAMBEDU To K.K.NAGAR,3
bus_5364,5364,bus,70C,KOYAMBEDU MARKET To TAMBARAM WEST,3
bus_5365,5365,bus,60D,PAMMAL KAMARAJAPURAM To KCBT - KILAMBAKKAM,3
bus_5366,5366,bus,60D,KCBT - KILAMBAKKAM To PAMMAL KAMARAJAPURAM,3
bus_5370,5370,bus,65A,MUTHAPUDUPET To THYAGARAYA NAGAR,3
bus_5371,5371,bus,65A,THYAGARAYA NAGAR To MUTHAPUDUPET,3
bus_5372,5372,bus,70CCT,LITTLE FLOWER CONVENT To M.G.R.KOYAMBEDU,3
bus_5373,5373,bus,70VCT,CEMENT ROAD To M.G.R.KOYAMBEDU,3
bus_5374,5374,bus,70CCT,M.G.R.KOYAMBEDU To LITTLE FLOWER CONVENT,3
bus_5376,5376,bus,66PCT,KCBT - KILAMBAKKAM To AIRPORT METRO,3
bus_5377,5377,bus,66PCT,AIRPORT METRO To KCBT - KILAMBAKKAM,3
bus_5410,5410,bus,109,BROADWAY To THIRUVANMIYUR,3
bus_5411,5411,bus,109,THIRUVANMIYUR To BROADWAY,3
bus_5412,5412,bus,109ACT,ADYAR DEPOT To THIRUVIDANTHAI,3
bus_5413,5413,bus,109ACT,THIRUVIDANTHAI To ADYAR DEPOT,3
bus_5417,5417,bus,28CT,VALLALAR NAGAR To EGMORE NORTH R.S,3
bus_5419,5419,bus,28CT,THIRUVOTRIYUR B.T To VALLALAR NAGAR,3
bus_5424,5424,bus,21P,KEELKATTALAI To BROADWAY,3
bus_5425,5425,bus,21P,BROADWAY To KEELKATTALAI,3
bus_5426,5426,bus,24A,KORATTUR To VIVEKANANDA HOUSE,3
bus_5436,5436,bus,54TCUT,SAIDAPET DEPOT To THYAGARAYA NAGAR,3
bus_5437,5437,bus,54TCUT,THYAGARAYA NAGAR To SAIDAPET DEPOT,3
bus_5438,5438,bus,51AXCT,LITTLE MOUNT To KCBT - KILAMBAKKAM,3
bus_5439,5439,bus,51AXCT,KCBT - KILAMBAKKAM To LITTLE MOUNT,3
bus_5440,5440,bus,21GCT,KCBT - KILAMBAKKAM To KOTTURPURAM,3
bus_5441,5441,bus,21GCT,KOTTURPURAM To KCBT - KILAMBAKKAM,3
bus_5442,5442,bus,1CCUT,BROADWAY To THIRUVANMIYUR,3
bus_5443,5443,bus,1CCUT,THIRUVANMIYUR To BROADWAY,3
bus_5444,5444,bus,24A,ANNA NAGAR WEST To KORATTUR,3
bus_5447,5447,bus,24A,VIVEKANANDA HOUSE To KORATTUR,3
bus_5450,5450,bus,11GCT,IYYAPPANTHANGAL To PANAGAL PARK,3
bus_5453,5453,bus,11GCT,PANAGAL PARK To IYYAPPANTHANGAL,3
bus_5454,5454,bus,24A,L.F.C To VIVEKANANDA HOUSE,3
bus_5455,5455,bus,V51CT,NEHRU NAGAR To THYAGARAYA NAGAR,3
bus_5456,5456,bus,24A,SECRETARIAT To KORATTUR,3
bus_5457,5457,bus,V51CT,THYAGARAYA NAGAR To NEHRU NAGAR,3
bus_5458,5458,bus,24A,KORATTUR To BROADWAY,3
bus_5459,5459,bus,597,IYYAPPANTHANGAL To THIRUVALLUR,3
bus_5460,5460,bus,V151,THYAGARAYA NAGAR To KCBT - KILAMBAKKAM,3
bus_5461,5461,bus,597,THIRUVALLUR To IYYAPPANTHANGAL,3
bus_5462,5462,bus,V151,KCBT - KILAMBAKKAM To THYAGARAYA NAGAR,3
bus_5463,5463,bus,11GCT,MANNIVAKKAM K.K.NAGAR To IYYAPPANTHANGAL,3
bus_5464,5464,bus,102X,ADYAR DEPOT To THIRUPORUR,3
bus_5465,5465,bus,102x,THIRUPORUR To ADYAR DEPOT,3
bus_5469,5469,bus,95XCT,TAMBARAM WEST To SHOLINGANALLUR,3
bus_5470,5470,bus,24AXCT,ANNA NAGAR WEST To TEACHERS COLONY,3
bus_5473,5473,bus,24AXCT,TEACHERS COLONY To ANNA NAGAR WEST,3
bus_5474,5474,bus,113A,GUINDY TVK ESTATE To TEACHERS COLONY,3
bus_5475,5475,bus,113A,TEACHERS COLONY To GUINDY TVK ESTATE,3
bus_5476,5476,bus,24AX,TEACHERS COLONY To VIVEKANANDA HOUSE,3
bus_5478,5478,bus,24AX,VIVEKANANDA HOUSE To TEACHERS COLONY,3
bus_5482,5482,bus,21GCT,KCBT - KILAMBAKKAM To BESANT NAGAR,3
bus_5483,5483,bus,21GCT,BESANT NAGAR To KCBT - KILAMBAKKAM,3
bus_5484,5484,bus,S67,MADHAVARAM B.T To AMBATTUR O.T,3
bus_5485,5485,bus,S67,AMBATTUR O.T To MADHAVARAM B.T,3
bus_5486,5486,bus,S67,MOOLAKADAI To AMBATTUR O.T,3
bus_5487,5487,bus,S67,AMBATTUR O.T To MOOLAKADAI,3
bus_5488,5488,bus,3CT,THYAGARAYA NAGAR To VELACHERY B.T,3
bus_5489,5489,bus,3CT,VELACHERY B.T To THYAGARAYA NAGAR,3
bus_5490,5490,bus,3CT,TODD HUNTER NAGAR To VELACHERY B.T,3
bus_5492,5492,bus,3CT,THIRUVANMIYUR To SAIDAPET WEST,3
bus_5496,5496,bus,88CCT,IYYAPPANTHANGAL To NANDAMBAKKAM VILLAGE,3
bus_5497,5497,bus,88CCT,NANDAMBAKKAM VILLAGE To IYYAPPANTHANGAL,3
bus_5498,5498,bus,88CCT,NANDAMBAKKAM VILLAGE To PORUR,3
bus_5499,5499,bus,515KCT,KCBT - KILAMBAKKAM To KELAMBAKKAM,3
bus_5500,5500,bus,88CCT,PORUR To NANDAMBAKKAM VILLAGE,3
bus_5501,5501,bus,88CCT,THYAGARAYA NAGAR To KUNDRATHUR B.T,3
bus_5502,5502,bus,515KCT,KELAMBAKKAM To KCBT - KILAMBAKKAM,3
bus_5503,5503,bus,57ct,PADIYANALLUR To REDHILLS,3
bus_5504,5504,bus,57ct,REDHILLS To PADIYANALLUR,3
bus_5510,5510,bus,57Fct,REDHILLS To KARANODAI,3
bus_5511,5511,bus,55P,TAMBARAM WEST To KCBT - KILAMBAKKAM,3
bus_5512,5512,bus,170TX,MOOLAKADAI To KCBT - KILAMBAKKAM,3
bus_5514,5514,bus,170TCT,K.KANNADASAN NAGAR To MOOLAKADAI,3
bus_5515,5515,bus,170TCT,MOOLAKADAI To K.KANNADASAN NAGAR,3
bus_5516,5516,bus,121GCT,MOOLAKADAI To K.KANNADASAN NAGAR,3
bus_5524,5524,bus,55P,KCBT - KILAMBAKKAM To TAMBARAM WEST,3
bus_5525,5525,bus,C2CT,M.G.R.CENTRAL To INS ADYAR,3
bus_5528,5528,bus,C2CUT,INS ADYAR To FORT STATION,3
bus_5529,5529,bus,21GCT,MYLAPORE To KCBT - KILAMBAKKAM,3
bus_5530,5530,bus,21GCT,KCBT - KILAMBAKKAM To MYLAPORE,3
bus_5532,5532,bus,21GCUT,TAMBARAM WEST To MYLAPORE,3
bus_5539,5539,bus,27BCT,M.G.R.CENTRAL To ANNA SQUARE,3
bus_5541,5541,bus,38CCT,OTTERI To T.V.K.NAGAR,3
bus_5542,5542,bus,38CCT,T.V.K.NAGAR To OTTERI,3
bus_5545,5545,bus,51P,VELACHERY B.T To PUDUPAKKAM RD.JN,3
bus_5547,5547,bus,73A,AVADI B.T To M.G.R.KOYAMBEDU,3
bus_5548,5548,bus,73A,M.G.R.KOYAMBEDU To AVADI B.T,3
bus_5549,5549,bus,V51CT,VELACHERY B.T To MEDAVAKKAM RD.JN,3
bus_5550,5550,bus,V51CT,MEDAVAKKAM RD.JN To VELACHERY B.T,3
bus_5551,5551,bus,32BCT,TONDIARPET To VIVEKANANDA HOUSE,3
bus_5552,5552,bus,32BCT,VIVEKANANDA HOUSE To TONDIARPET,3
bus_5553,5553,bus,18S,N.G.O.COLONY To KCBT - KILAMBAKKAM,3
bus_5554,5554,bus,18S,KCBT - KILAMBAKKAM To N.G.O.COLONY,3
bus_5555,5555,bus,66M,TAMBARAM WEST To SOUTH MALAYAMBAKKAM,3
bus_5556,5556,bus,66M,SOUTH MALAYAMBAKKAM To TAMBARAM WEST,3
bus_5557,5557,bus,66M,KUNDRATHUR DEPOT To SOUTH MALAYAMBAKKAM,3
bus_5558,5558,bus,66M,TAMBARAM WEST To KUNDRATHUR DEPOT,3
bus_5561,5561,bus,2ACT,BASIN BRIDGE DEPOT To K.KANNADASAN NAGAR,3
bus_5562,5562,bus,2ACT,K.KANNADASAN NAGAR To BASIN BRIDGE DEPOT,3
bus_5563,5563,bus,64KCT,MOOLAKADAI To KODUNGAIYUR PARVATHI NAGAR,3
bus_5564,5564,bus,64KCT,KODUNGAIYUR PARVATHI NAGAR To MOOLAKADAI,3
bus_5565,5565,bus,S90,TAMBARAM WEST To GUNDUMEDU ANNA NAGAR,3
bus_5566,5566,bus,S90,GUNDUMEDU ANNA NAGAR To TAMBARAM WEST,3
bus_5567,5567,bus,500PX,AIRPORT METRO To CHENGALPET,3
bus_5568,5568,bus,500PX,CHENGALPET To AIRPORT METRO,3
bus_5569,5569,bus,47ACT,I.C.F To THYAGARAYA NAGAR,3
bus_5570,5570,bus,47ACT,THYAGARAYA NAGAR To I.C.F,3
bus_5571,5571,bus,55X,NEHRU NAGAR To MANNIVAKKAM W.TANK,3
bus_5572,5572,bus,55X,MANNIVAKKAM W.TANK To NEHRU NAGAR,3
bus_5573,5573,bus,32B,TONDIARPET To VIVEKANANDA HOUSE,3
bus_5574,5574,bus,32B,VIVEKANANDA HOUSE To TONDIARPET,3
bus_5575,5575,bus,A51CT,TAMBARAM WEST To SAIDAPET,3
bus_5576,5576,bus,A51CT,SAIDAPET To TAMBARAM WEST,3
bus_5577,5577,bus,A51,NEHRU NAGAR To BROADWAY,3
bus_5578,5578,bus,A51,BROADWAY To NEHRU NAGAR,3
bus_5579,5579,bus,S18K,M.G.R.CENTRAL To INS ADYAR,3
bus_5580,5580,bus,S18K,INS ADYAR To M.G.R.CENTRAL,3
bus_5581,5581,bus,102P,PERUMBAKKAM TNUHDB To KANNAGI NAGAR TNUHDB,3
bus_5582,5582,bus,B19,KANNAGI NAGAR TNUHDB To SIRUSERI I.T PARK,3
bus_5583,5583,bus,B19,SIRUSERI I.T PARK To KANNAGI NAGAR TNUHDB,3
bus_5584,5584,bus,26G,BROADWAY To RAMAPURAM,3
bus_5585,5585,bus,26G,RAMAPURAM To BROADWAY,3
bus_5586,5586,bus,26GCT,RAMAPURAM To VADAPALANI,3
bus_5587,5587,bus,70CCT,RAMAPURAM To KCBT - KILAMBAKKAM,3
bus_5588,5588,bus,70CCT,KCBT - KILAMBAKKAM To RAMAPURAM,3
bus_5589,5589,bus,70CCT,RAMAPURAM To K.K.NAGAR,3
bus_5593,5593,bus,70CCT,K.K.NAGAR To RAMAPURAM,3
bus_5594,5594,bus,M1,THIRUVANMIYUR To MADIPAKKAM B.T,3
bus_5595,5595,bus,51C,VELACHERY B.T To PUDUPAKKAM RD.JN,3
bus_5596,5596,bus,51C,PUDUPAKKAM RD.JN To VELACHERY B.T,3
bus_5597,5597,bus,51CX,SAIDAPET To PUDUPAKKAM RD.JN,3
bus_5598,5598,bus,51CX,PUDUPAKKAM RD.JN To SAIDAPET,3
bus_5599,5599,bus,28CT,QUAID E-MILLATH GOVT COLLEGE To THIRUVOTRIYUR B.T,3
bus_5600,5600,bus,28X,QUAID E-MILLATH GOVT COLLEGE To ENNORE,3
bus_5601,5601,bus,28CT,THANGAL TOLLGATE To EGMORE NORTH R.S,3
bus_5602,5602,bus,46GCT,ANNA NAGAR EAST To M.G.R.KOYAMBEDU,3
bus_5603,5603,bus,46GCT,M.G.R.KOYAMBEDU To ANNA NAGAR EAST,3
bus_5609,5609,bus,159CT,THIRUVERKADU To ANNA NAGAR EAST,3
bus_5610,5610,bus,583,TAMBARAM SANATORIUM To PADAPPAI,3
bus_5611,5611,bus,583,PADAPPAI To TAMBARAM SANATORIUM,3
bus_5614,5614,bus,556,THANGAL TOLLGATE To PONNERI,3
bus_5615,5615,bus,36V,THANGAL TOLLGATE To REDHILLS,3
bus_5616,5616,bus,36V,REDHILLS To THANGAL TOLLGATE,3
bus_5617,5617,bus,38DCT,EGMORE NORTH R.S To TONDIARPET,3
bus_5618,5618,bus,109T,KOVALAM To THANGAL TOLLGATE,3
bus_5619,5619,bus,556,POONGERI To THANGAL TOLLGATE,3
bus_5622,5622,bus,55H,KEERAPAKKAM TNUHDB To AIRPORT METRO,3
bus_5623,5623,bus,55H,AIRPORT METRO To KEERAPAKKAM TNUHDB,3
bus_5625,5625,bus,36M,TONDIARPET To VICHOOR,3
bus_5626,5626,bus,36M,VICHOOR To TONDIARPET,3
bus_5627,5627,bus,C56C,THIRUVOTRIYUR B.T To TONDIARPET,3
bus_5628,5628,bus,S56,TONDIARPET To MANALI,3
bus_5629,5629,bus,S56,MANALI To TONDIARPET,3
bus_5630,5630,bus,121DCT,MANALI NEW TOWN To MOOLAKADAI,3
bus_5631,5631,bus,121DCT,MOOLAKADAI To MANALI NEW TOWN,3
bus_5632,5632,bus,515CT,MAMALLAPURAM To THIRUPORUR,3
bus_5633,5633,bus,515CT,THIRUPORUR To MAMALLAPURAM,3
bus_5636,5636,bus,761,M.G.R.KOYAMBEDU To M.G.R.KOYAMBEDU,3
bus_5637,5637,bus,113E,M.M.B.T To GUINDY TVK ESTATE,3
bus_5638,5638,bus,113E,GUINDY TVK ESTATE To M.M.B.T,3
bus_5639,5639,bus,49CT,GUINDY TVK ESTATE To ADYAR B.T,3
bus_5640,5640,bus,19A,ADYAR DEPOT To SEMMANCHERI TNUHDB,3
bus_5641,5641,bus,19A,SEMMANCHERI TNUHDB To ADYAR DEPOT,3
bus_5642,5642,bus,19ACT,THYAGARAYA NAGAR To ADYAR DEPOT,3
bus_5643,5643,bus,102CT,BROADWAY To SHOLINGANALLUR,3
bus_5644,5644,bus,19ACT,ADYAR DEPOT To THYAGARAYA NAGAR,3
bus_5645,5645,bus,21LCT,ADYAR DEPOT To BROADWAY,3
bus_5646,5646,bus,102C,SEMMANCHERI TNUHDB To KELAMBAKKAM,3
bus_5648,5648,bus,102C,SEMMANCHERI TNUHDB To SANTHOME SCHOOL,3
bus_5649,5649,bus,102C,SANTHOME SCHOOL To SEMMANCHERI TNUHDB,3
bus_5652,5652,bus,2B,KAVIARASU KANNADASAN NAGAR B.T To KAVIARASU KANNADASAN NAGAR B.T,3
bus_5653,5653,bus,2B,DEPOT VYASARPADI To K.KANNADASAN NAGAR,3
bus_5654,5654,bus,2B,K.KANNADASAN NAGAR To DEPOT VYASARPADI,3
bus_5655,5655,bus,64E,M.G.R.CENTRAL To M.M.B.T,3
bus_5656,5656,bus,64E,M.M.B.T To M.G.R.CENTRAL,3
bus_5658,5658,bus,64E,M.G.R.CENTRAL To DEPOT VYASARPADI,3
bus_5659,5659,bus,64E,DEPOT VYASARPADI To M.G.R.CENTRAL,3
bus_5660,5660,bus,113EX,DEPOT VYASARPADI To GUINDY TVK ESTATE,3
bus_5661,5661,bus,113EX,GUINDY TVK ESTATE To DEPOT VYASARPADI,3
bus_5663,5663,bus,57ct,DEPOT VYASARPADI To VALLALAR NAGAR,3
bus_5664,5664,bus,57ct,VALLALAR NAGAR To DEPOT VYASARPADI,3
bus_5665,5665,bus,164E,MANALI To PERAMBUR B.T,3
bus_5666,5666,bus,164E,PERAMBUR B.T To MANALI,3
bus_5667,5667,bus,164E,MANALI To DEPOT VYASARPADI,3
bus_5668,5668,bus,164E,DEPOT VYASARPADI To MANALI,3
bus_5669,5669,bus,164E,DEPOT VYASARPADI To PERAMBUR B.T,3
bus_5670,5670,bus,164E,PERAMBUR B.T To DEPOT VYASARPADI,3
bus_5671,5671,bus,170TX,K.KANNADASAN NAGAR To M.K.B.NAGAR,3
bus_5672,5672,bus,170TX,M.K.B.NAGAR To K.KANNADASAN NAGAR,3
bus_5673,5673,bus,46,DEPOT VYASARPADI To T.V.K.NAGAR,3
bus_5674,5674,bus,46,T.V.K.NAGAR To DEPOT VYASARPADI,3
bus_5675,5675,bus,170C,T.V.K.NAGAR To DEPOT VYASARPADI,3
bus_5677,5677,bus,6DX,FORESHORE ESTATE To ENNORE,3
bus_5678,5678,bus,6DX,ENNORE To FORESHORE ESTATE,3
bus_5679,5679,bus,170C,M.K.B.NAGAR To GUINDY TVK ESTATE,3
bus_5680,5680,bus,6D,ENNORE To THANGAL TOLLGATE,3
bus_5682,5682,bus,170C,GUINDY TVK ESTATE To M.K.B.NAGAR,3
bus_5684,5684,bus,46GCT,M.K.B.NAGAR To DEPOT VYASARPADI,3
bus_5685,5685,bus,46GCT,DEPOT VYASARPADI To M.K.B.NAGAR,3
bus_5704,5704,bus,57CT,REDHILLS To DEPOT VYASARPADI,3
bus_5705,5705,bus,18A,VALLALAR NAGAR To KCBT - KILAMBAKKAM,3
bus_5706,5706,bus,18A,KCBT - KILAMBAKKAM To VALLALAR NAGAR,3
bus_5707,5707,bus,C33,K.KANNADASAN NAGAR To K.KANNADASAN NAGAR,3
bus_5709,5709,bus,C64,K.KANNADASAN NAGAR To K.KANNADASAN NAGAR,3
bus_5710,5710,bus,95XCT,SEMMANCHERI TNUHDB To KCBT - KILAMBAKKAM,3
bus_5713,5713,bus,51ACT,SAIDAPET To KCBT - KILAMBAKKAM,3
bus_5714,5714,bus,51ACT,KCBT - KILAMBAKKAM To SAIDAPET,3
bus_5715,5715,bus,95X,THIRUVANMIYUR To SEMMANCHERI TNUHDB,3
bus_5717,5717,bus,95XCT,KCBT - KILAMBAKKAM To SEMMANCHERI TNUHDB,3
bus_5718,5718,bus,99CT,SEMMANCHERI TNUHDB To ADYAR B.T,3
bus_5721,5721,bus,500V,TAMBARAM SANATORIUM To VENBAKKAM,3
bus_5723,5723,bus,500V,VENBAKKAM To TAMBARAM SANATORIUM,3
bus_5724,5724,bus,170TX,M.K.B.NAGAR To KCBT - KILAMBAKKAM,3
bus_5725,5725,bus,170TX,KCBT - KILAMBAKKAM To M.K.B.NAGAR,3
bus_5726,5726,bus,102P,KANNAGI NAGAR TNUHDB To PERUMBAKKAM TNUHDB,3
bus_5727,5727,bus,164E,M.K.B.NAGAR To PERAMBUR B.T,3
bus_5728,5728,bus,164E,PERAMBUR B.T To M.K.B.NAGAR,3
bus_5729,5729,bus,164E,MANALI To M.K.B.NAGAR,3
bus_5730,5730,bus,164E,M.K.B.NAGAR To MANALI,3
bus_5731,5731,bus,500,TAMBARAM SANATORIUM To CHENGALPET,3
bus_5732,5732,bus,55X,MANNIVAKKAM W.TANK To TAMBARAM SANATORIUM,3
bus_5733,5733,bus,101,THANGAL TOLLGATE To POONAMALLEE B.T,3
bus_5734,5734,bus,37CT,M.K.B.NAGAR To IYYAPPANTHANGAL,3
bus_5735,5735,bus,37CT,IYYAPPANTHANGAL To M.K.B.NAGAR,3
bus_5738,5738,bus,3CT,THIRUVANMIYUR To GUINDY R.S,3
bus_5739,5739,bus,3CT,GUINDY R.S To THIRUVANMIYUR,3
bus_5740,5740,bus,164,M.K.B.NAGAR To MINJUR N.T,3
bus_5741,5741,bus,164,MINJUR N.T To M.K.B.NAGAR,3
bus_5742,5742,bus,27B,M.M.D.A.COLONY RD.JN To SECRETARIAT,3
bus_5743,5743,bus,27B,SECRETARIAT To M.M.D.A.COLONY RD.JN,3
bus_5744,5744,bus,55K,GUDUVANCHERY To MURUGAMANGALAM TNUHDB,3
bus_5745,5745,bus,55K,MURUGAMANGALAM TNUHDB To GUDUVANCHERY,3
bus_5747,5747,bus,55K,MURUGAMANGALAM TNUHDB To AIRPORT METRO,3
bus_5748,5748,bus,S79,PALLAVARAM R.S To ALANDUR GANDHI MARKET,3
bus_5749,5749,bus,S79,CEMENT ROAD To PALLAVARAM R.S,3
bus_5750,5750,bus,S79,ALANDUR GANDHI MARKET To CEMENT ROAD,3
bus_5751,5751,bus,S79,ALANDUR GANDHI MARKET To PALLAVARAM R.S,3
bus_5756,5756,bus,28B,ENNORE To QUAID E-MILLATH GOVT COLLEGE,3
bus_5757,5757,bus,121GX,M.K.B.NAGAR To M.G.R.KOYAMBEDU,3
bus_5758,5758,bus,121GX,M.G.R.KOYAMBEDU To M.K.B.NAGAR,3
bus_5759,5759,bus,72X,THIRUVERKADU To TODD HUNTER NAGAR,3
bus_5760,5760,bus,72X,TODD HUNTER NAGAR To THIRUVERKADU,3
bus_5761,5761,bus,72CT,M.G.R.KOYAMBEDU To THYAGARAYA NAGAR,3
bus_5763,5763,bus,19CT,THIRUPORUR To PERUMBAKKAM TNUHDB,3
bus_5764,5764,bus,19CT,PERUMBAKKAM TNUHDB To THIRUPORUR,3
bus_5765,5765,bus,19A,PERUMBAKKAM TNUHDB To THYAGARAYA NAGAR,3
bus_5766,5766,bus,72CT,THYAGARAYA NAGAR To M.G.R.KOYAMBEDU,3
bus_5767,5767,bus,102P,PERUMBAKKAM TNUHDB To WELLINGTON SCHOOL-V.HOUSE,3
bus_5768,5768,bus,102P,WELLINGTON SCHOOL-V.HOUSE To BROADWAY,3
bus_5769,5769,bus,102P,BROADWAY To THIRUVANMIYUR,3
bus_5770,5770,bus,102PCT,THIRUVANMIYUR To BROADWAY,3
bus_5771,5771,bus,102PCT,BROADWAY To WELLINGTON SCHOOL-V.HOUSE,3
bus_5772,5772,bus,102PCT,WELLINGTON SCHOOL-V.HOUSE To PERUMBAKKAM TNUHDB,3
bus_5785,5785,bus,102XCT,PERUMBAKKAM TNUHDB To SIRUSERI I.T PARK,3
bus_5788,5788,bus,102XCT,SIRUSERI I.T PARK To PERUMBAKKAM TNUHDB,3
bus_5790,5790,bus,MAA2CT,CHENNAI AIRPORT To PERUMBAKKAM TNUHDB,3
bus_5791,5791,bus,MAA2CT,PERUMBAKKAM TNUHDB To CHENNAI AIRPORT,3
bus_5797,5797,bus,570CT,GUINDY TVK ESTATE To SIRUSERI I.T PARK,3
bus_5798,5798,bus,570CT,SIRUSERI I.T PARK To GUINDY TVK ESTATE,3
bus_5799,5799,bus,568CT,ADYAR DEPOT To MAMALLAPURAM,3
bus_5801,5801,bus,33CT,M.K.B.NAGAR To BROADWAY,3
bus_5802,5802,bus,33CT,BROADWAY To M.K.B.NAGAR,3
bus_5803,5803,bus,96,ADYAR B.T To TAMBARAM WEST,3
bus_5804,5804,bus,96,TAMBARAM WEST To ADYAR B.T,3
bus_5805,5805,bus,60GCT,CEMENT ROAD To ADYAR B.T,3
bus_5806,5806,bus,60GCT,ADYAR B.T To CEMENT ROAD,3
bus_5807,5807,bus,5CET,KANNAGI NAGAR TNUHDB To ST FRANCIS XAVIER SCHOOL,3
bus_5808,5808,bus,5CET,ST FRANCIS XAVIER SCHOOL To KANNAGI NAGAR TNUHDB,3
bus_5809,5809,bus,5CET,ST FRANCIS XAVIER SCHOOL To BROADWAY,3
bus_5810,5810,bus,5CET,BROADWAY To ST FRANCIS XAVIER SCHOOL,3
bus_5811,5811,bus,40HCT,PATTABIRAM To L.F.C,3
bus_5812,5812,bus,40HCT,L.F.C To PATTABIRAM,3
bus_5814,5814,bus,11HCT,L.F.C To ANNA SQUARE,3
bus_5815,5815,bus,11HCT,ANNA SQUARE To L.F.C,3
bus_5816,5816,bus,102KCT,BROADWAY To SATHYA NAGAR,3
bus_5817,5817,bus,102KCT,SATHYA NAGAR To SANTHOME SCHOOL,3
bus_5818,5818,bus,102KCT,SANTHOME SCHOOL To KANNAGI NAGAR TNUHDB,3
bus_5819,5819,bus,102KCT,KANNAGI NAGAR TNUHDB To SANTHOME SCHOOL,3
bus_5820,5820,bus,102KCT,KANNAGI NAGAR TNUHDB To WELLINGTON SCHOOL-V.HOUSE,3
bus_5822,5822,bus,102KCT,BROADWAY To WELLINGTON SCHOOL-V.HOUSE,3
bus_5823,5823,bus,102KCT,WELLINGTON SCHOOL-V.HOUSE To KANNAGI NAGAR TNUHDB,3
bus_5824,5824,bus,102CCT,SEMMANCHERI TNUHDB To YMCA HR.SCHOOL,3
bus_5825,5825,bus,102CCT,YMCA HR.SCHOOL To SEMMANCHERI TNUHDB,3
bus_5826,5826,bus,102CCT,YMCA HR.SCHOOL To BROADWAY,3
bus_5827,5827,bus,19ACT,THYAGARAYA NAGAR To YMCA HR.SCHOOL,3
bus_5828,5828,bus,2ACT,MURTHUZAVIYA ORIENTAL SECONDARY HIGH SCHOOL To M.K.B.NAGAR,3
bus_5829,5829,bus,2ACT,M.K.B.NAGAR To MURTHUZAVIYA ORIENTAL SECONDARY HIGH SCHOOL,3
bus_5830,5830,bus,2ACT,MURTHUZAVIYA ORIENTAL SECONDARY HIGH SCHOOL To ANNA SQUARE,3
bus_5831,5831,bus,2ACT,ANNA SQUARE To MURTHUZAVIYA ORIENTAL SECONDARY HIGH SCHOOL,3
bus_5832,5832,bus,11MCT,IYYAPPANTHANGAL To GOVT.GIRLS SCHOOL,3
bus_5833,5833,bus,11MCT,GOVT.GIRLS SCHOOL To IYYAPPANTHANGAL,3
bus_5834,5834,bus,11MCT,GOVT.GIRLS SCHOOL To BROADWAY,3
bus_5835,5835,bus,11MCT,BROADWAY To GOVT.GIRLS SCHOOL,3
bus_5836,5836,bus,49CT,IYYAPPANTHANGAL To ARMY PUBLIC SCHOOL NANDAMBAKKAM,3
bus_5837,5837,bus,49CT,ARMY PUBLIC SCHOOL NANDAMBAKKAM To IYYAPPANTHANGAL,3
bus_5838,5838,bus,49CT,ARMY PUBLIC SCHOOL NANDAMBAKKAM To THIRUVANMIYUR,3
bus_5839,5839,bus,49CT,THIRUVANMIYUR To ARMY PUBLIC SCHOOL NANDAMBAKKAM,3
bus_5846,5846,bus,7MCT,DOVETON To BROADWAY,3
bus_5847,5847,bus,7MCT,BROADWAY To DOVETON,3
bus_5848,5848,bus,24ACT,MONAHAN GIRLS HIGHER SECONDARY SCHOOL To VIVEKANANDA HOUSE,3
bus_5849,5849,bus,24AXCT,VIVEKANANDA HOUSE To MONAHAN GIRLS HIGHER SECONDARY SCHOOL,3
bus_5850,5850,bus,24ACT,KORATTUR To MONAHAN GIRLS HIGHER SECONDARY SCHOOL,3
bus_5851,5851,bus,24AXCT,MONAHAN GIRLS HIGHER SECONDARY SCHOOL To TEACHERS COLONY,3
bus_5852,5852,bus,56PCT,THANGAL TOLLGATE To MINJUR,3
bus_5853,5853,bus,56PCT,MINJUR To THANGAL TOLLGATE,3
bus_5854,5854,bus,32BCT,M.G.R.CENTRAL To VIVEKANANDA HOUSE,3
bus_5855,5855,bus,32BCT,KORUKKUPET To M.G.R.CENTRAL,3
bus_5857,5857,bus,T29CCT,THIRUVANMIYUR To MANDAVELI,3
bus_5858,5858,bus,T29CCT,MANDAVELI To THIRUVANMIYUR,3
bus_5860,5860,bus,51CT,CHRIST KING CONVENT To VELACHERY B.T,3
bus_5862,5862,bus,51CT,TAMBARAM WEST To CHRIST KING CONVENT,3
bus_5863,5863,bus,89TCT,TAMBARAM WEST To SOMANGALAM,3
bus_5884,5884,bus,89TCT,SOMANGALAM To TAMBARAM WEST,3
bus_5893,5893,bus,27BCT,SATHYA NAGAR To CHINDATHARIPET,3
bus_5894,5894,bus,27BCT,CHINDATHARIPET To SATHYA NAGAR,3
bus_5895,5895,bus,27BCT,M.G.R.KOYAMBEDU To CHINDATHARIPET,3
bus_5896,5896,bus,27BCT,CHINDATHARIPET To M.G.R.KOYAMBEDU,3
bus_5897,5897,bus,27BCT,ANNA SQUARE To EGMORE  SCHOOL,3
bus_5898,5898,bus,27BCT,EGMORE  SCHOOL To M.G.R.KOYAMBEDU,3
bus_5911,5911,bus,55N,TAMBARAM WEST To KEERAPAKKAM TNUHDB,3
bus_5912,5912,bus,55N,KEERAPAKKAM TNUHDB To TAMBARAM WEST,3
bus_5915,5915,bus,102E,SIRUSERI I.T PARK To THIRUVANMIYUR,3
bus_5916,5916,bus,102E,THIRUVANMIYUR To SIRUSERI I.T PARK,3
bus_5917,5917,bus,S78,ASHOK NAGAR METRO R.S To ST LOUIS COLLEGE ADYAR,3
bus_5918,5918,bus,S78,ST LOUIS COLLEGE ADYAR To ASHOK NAGAR METRO R.S,3
bus_5919,5919,bus,19AX,THYAGARAYA NAGAR To PERUMBAKKAM TNUHDB,3
bus_5920,5920,bus,19AX,PERUMBAKKAM TNUHDB To THYAGARAYA NAGAR,3
bus_5921,5921,bus,57CT,M.K.B.NAGAR To REDHILLS,3
bus_5922,5922,bus,57FCT,BROADWAY To REDHILLS,3
bus_5924,5924,bus,57fct,M.K.B.NAGAR To KARANODAI,3
bus_5925,5925,bus,V51CT,SAIDAPET To MEDAVAKKAM QMC,3
bus_5926,5926,bus,V51CT,MEDAVAKKAM QMC To SAIDAPET,3
bus_5927,5927,bus,V51CT,VELACHERY B.T To MEDAVAKKAM QMC,3
bus_5928,5928,bus,V51CT,MEDAVAKKAM QMC To VELACHERY B.T,3
bus_5929,5929,bus,55KCT,KCBT - KILAMBAKKAM To KEERAPAKKAM TNUHDB,3
bus_5930,5930,bus,55KCT,KEERAPAKKAM TNUHDB To KCBT - KILAMBAKKAM,3
bus_5931,5931,bus,578M,POONAMALLEE B.T To MEPPEDU RD.JN.,3
bus_5932,5932,bus,578M,MEPPEDU RD.JN. To POONAMALLEE B.T,3
bus_5940,5940,bus,753,SEMMANCHERI TNUHDB To KCBT - KILAMBAKKAM,3
bus_5941,5941,bus,99CT,PERUMBAKKAM TNUHDB To ADYAR B.T,3
bus_5942,5942,bus,99CT,ADYAR B.T To PERUMBAKKAM TNUHDB,3
bus_5946,5946,bus,515CT,TAMBARAM To KELAMBAKKAM,3
bus_5947,5947,bus,515CT,KELAMBAKKAM To TAMBARAM,3
